,Date,date_dt,location,count,month_day,year,month,location_name
0,2013-01-01 00:00:00,2013-01-01,1^ALEX,0.0,01-01,2013,1,Alexandra Bridge
1,2013-01-02 00:00:00,2013-01-02,1^ALEX,0.0,01-02,2013,1,Alexandra Bridge
2,2013-01-03 00:00:00,2013-01-03,1^ALEX,0.0,01-03,2013,1,Alexandra Bridge
3,2013-01-04 00:00:00,2013-01-04,1^ALEX,0.0,01-04,2013,1,Alexandra Bridge
4,2013-01-05 00:00:00,2013-01-05,1^ALEX,0.0,01-05,2013,1,Alexandra Bridge
5,2013-01-06 00:00:00,2013-01-06,1^ALEX,1.0,01-06,2013,1,Alexandra Bridge
6,2013-01-07 00:00:00,2013-01-07,1^ALEX,0.0,01-07,2013,1,Alexandra Bridge
7,2013-01-08 00:00:00,2013-01-08,1^ALEX,0.0,01-08,2013,1,Alexandra Bridge
8,2013-01-09 00:00:00,2013-01-09,1^ALEX,0.0,01-09,2013,1,Alexandra Bridge
9,2013-01-10 00:00:00,2013-01-10,1^ALEX,0.0,01-10,2013,1,Alexandra Bridge
10,2013-01-11 00:00:00,2013-01-11,1^ALEX,0.0,01-11,2013,1,Alexandra Bridge
11,2013-01-12 00:00:00,2013-01-12,1^ALEX,0.0,01-12,2013,1,Alexandra Bridge
12,2013-01-13 00:00:00,2013-01-13,1^ALEX,0.0,01-13,2013,1,Alexandra Bridge
13,2013-01-14 00:00:00,2013-01-14,1^ALEX,0.0,01-14,2013,1,Alexandra Bridge
14,2013-01-15 00:00:00,2013-01-15,1^ALEX,0.0,01-15,2013,1,Alexandra Bridge
15,2013-01-16 00:00:00,2013-01-16,1^ALEX,0.0,01-16,2013,1,Alexandra Bridge
16,2013-01-17 00:00:00,2013-01-17,1^ALEX,1.0,01-17,2013,1,Alexandra Bridge
17,2013-01-18 00:00:00,2013-01-18,1^ALEX,1.0,01-18,2013,1,Alexandra Bridge
18,2013-01-19 00:00:00,2013-01-19,1^ALEX,0.0,01-19,2013,1,Alexandra Bridge
19,2013-01-20 00:00:00,2013-01-20,1^ALEX,1.0,01-20,2013,1,Alexandra Bridge
20,2013-01-21 00:00:00,2013-01-21,1^ALEX,0.0,01-21,2013,1,Alexandra Bridge
21,2013-01-22 00:00:00,2013-01-22,1^ALEX,0.0,01-22,2013,1,Alexandra Bridge
22,2013-01-23 00:00:00,2013-01-23,1^ALEX,0.0,01-23,2013,1,Alexandra Bridge
23,2013-01-24 00:00:00,2013-01-24,1^ALEX,0.0,01-24,2013,1,Alexandra Bridge
24,2013-01-25 00:00:00,2013-01-25,1^ALEX,0.0,01-25,2013,1,Alexandra Bridge
25,2013-01-26 00:00:00,2013-01-26,1^ALEX,0.0,01-26,2013,1,Alexandra Bridge
26,2013-01-27 00:00:00,2013-01-27,1^ALEX,0.0,01-27,2013,1,Alexandra Bridge
27,2013-01-28 00:00:00,2013-01-28,1^ALEX,0.0,01-28,2013,1,Alexandra Bridge
28,2013-01-29 00:00:00,2013-01-29,1^ALEX,0.0,01-29,2013,1,Alexandra Bridge
29,2013-01-30 00:00:00,2013-01-30,1^ALEX,5.0,01-30,2013,1,Alexandra Bridge
30,2013-01-31 00:00:00,2013-01-31,1^ALEX,4.0,01-31,2013,1,Alexandra Bridge
31,2013-02-01 00:00:00,2013-02-01,1^ALEX,0.0,02-01,2013,2,Alexandra Bridge
32,2013-02-02 00:00:00,2013-02-02,1^ALEX,1.0,02-02,2013,2,Alexandra Bridge
33,2013-02-03 00:00:00,2013-02-03,1^ALEX,0.0,02-03,2013,2,Alexandra Bridge
34,2013-02-04 00:00:00,2013-02-04,1^ALEX,0.0,02-04,2013,2,Alexandra Bridge
35,2013-02-05 00:00:00,2013-02-05,1^ALEX,0.0,02-05,2013,2,Alexandra Bridge
36,2013-02-06 00:00:00,2013-02-06,1^ALEX,4.0,02-06,2013,2,Alexandra Bridge
37,2013-02-07 00:00:00,2013-02-07,1^ALEX,0.0,02-07,2013,2,Alexandra Bridge
38,2013-02-08 00:00:00,2013-02-08,1^ALEX,4.0,02-08,2013,2,Alexandra Bridge
39,2013-02-09 00:00:00,2013-02-09,1^ALEX,1.0,02-09,2013,2,Alexandra Bridge
40,2013-02-10 00:00:00,2013-02-10,1^ALEX,1.0,02-10,2013,2,Alexandra Bridge
41,2013-02-11 00:00:00,2013-02-11,1^ALEX,2.0,02-11,2013,2,Alexandra Bridge
42,2013-02-12 00:00:00,2013-02-12,1^ALEX,1.0,02-12,2013,2,Alexandra Bridge
43,2013-02-13 00:00:00,2013-02-13,1^ALEX,1.0,02-13,2013,2,Alexandra Bridge
44,2013-02-14 00:00:00,2013-02-14,1^ALEX,8.0,02-14,2013,2,Alexandra Bridge
45,2013-02-15 00:00:00,2013-02-15,1^ALEX,1.0,02-15,2013,2,Alexandra Bridge
46,2013-02-16 00:00:00,2013-02-16,1^ALEX,3.0,02-16,2013,2,Alexandra Bridge
47,2013-02-17 00:00:00,2013-02-17,1^ALEX,0.0,02-17,2013,2,Alexandra Bridge
48,2013-02-18 00:00:00,2013-02-18,1^ALEX,3.0,02-18,2013,2,Alexandra Bridge
49,2013-02-19 00:00:00,2013-02-19,1^ALEX,4.0,02-19,2013,2,Alexandra Bridge
50,2013-02-20 00:00:00,2013-02-20,1^ALEX,2.0,02-20,2013,2,Alexandra Bridge
51,2013-02-21 00:00:00,2013-02-21,1^ALEX,1.0,02-21,2013,2,Alexandra Bridge
52,2013-02-22 00:00:00,2013-02-22,1^ALEX,2.0,02-22,2013,2,Alexandra Bridge
53,2013-02-23 00:00:00,2013-02-23,1^ALEX,1.0,02-23,2013,2,Alexandra Bridge
54,2013-02-24 00:00:00,2013-02-24,1^ALEX,1.0,02-24,2013,2,Alexandra Bridge
55,2013-02-25 00:00:00,2013-02-25,1^ALEX,4.0,02-25,2013,2,Alexandra Bridge
56,2013-02-26 00:00:00,2013-02-26,1^ALEX,4.0,02-26,2013,2,Alexandra Bridge
57,2013-02-27 00:00:00,2013-02-27,1^ALEX,8.0,02-27,2013,2,Alexandra Bridge
58,2013-02-28 00:00:00,2013-02-28,1^ALEX,0.0,02-28,2013,2,Alexandra Bridge
59,2013-03-01 00:00:00,2013-03-01,1^ALEX,0.0,03-01,2013,3,Alexandra Bridge
60,2013-03-02 00:00:00,2013-03-02,1^ALEX,0.0,03-02,2013,3,Alexandra Bridge
61,2013-03-03 00:00:00,2013-03-03,1^ALEX,0.0,03-03,2013,3,Alexandra Bridge
62,2013-03-04 00:00:00,2013-03-04,1^ALEX,0.0,03-04,2013,3,Alexandra Bridge
63,2013-03-05 00:00:00,2013-03-05,1^ALEX,5.0,03-05,2013,3,Alexandra Bridge
64,2013-03-06 00:00:00,2013-03-06,1^ALEX,7.0,03-06,2013,3,Alexandra Bridge
65,2013-03-07 00:00:00,2013-03-07,1^ALEX,4.0,03-07,2013,3,Alexandra Bridge
66,2013-03-08 00:00:00,2013-03-08,1^ALEX,17.0,03-08,2013,3,Alexandra Bridge
67,2013-03-09 00:00:00,2013-03-09,1^ALEX,27.0,03-09,2013,3,Alexandra Bridge
68,2013-03-10 00:00:00,2013-03-10,1^ALEX,9.0,03-10,2013,3,Alexandra Bridge
69,2013-03-11 00:00:00,2013-03-11,1^ALEX,24.0,03-11,2013,3,Alexandra Bridge
70,2013-03-12 00:00:00,2013-03-12,1^ALEX,14.0,03-12,2013,3,Alexandra Bridge
71,2013-03-13 00:00:00,2013-03-13,1^ALEX,23.0,03-13,2013,3,Alexandra Bridge
72,2013-03-14 00:00:00,2013-03-14,1^ALEX,22.0,03-14,2013,3,Alexandra Bridge
73,2013-03-15 00:00:00,2013-03-15,1^ALEX,10.0,03-15,2013,3,Alexandra Bridge
74,2013-03-16 00:00:00,2013-03-16,1^ALEX,3.0,03-16,2013,3,Alexandra Bridge
75,2013-03-17 00:00:00,2013-03-17,1^ALEX,26.0,03-17,2013,3,Alexandra Bridge
76,2013-03-18 00:00:00,2013-03-18,1^ALEX,23.0,03-18,2013,3,Alexandra Bridge
77,2013-03-19 00:00:00,2013-03-19,1^ALEX,0.0,03-19,2013,3,Alexandra Bridge
78,2013-03-20 00:00:00,2013-03-20,1^ALEX,0.0,03-20,2013,3,Alexandra Bridge
79,2013-03-21 00:00:00,2013-03-21,1^ALEX,0.0,03-21,2013,3,Alexandra Bridge
80,2013-03-22 00:00:00,2013-03-22,1^ALEX,1.0,03-22,2013,3,Alexandra Bridge
81,2013-03-23 00:00:00,2013-03-23,1^ALEX,0.0,03-23,2013,3,Alexandra Bridge
82,2013-03-24 00:00:00,2013-03-24,1^ALEX,5.0,03-24,2013,3,Alexandra Bridge
83,2013-03-25 00:00:00,2013-03-25,1^ALEX,15.0,03-25,2013,3,Alexandra Bridge
84,2013-03-26 00:00:00,2013-03-26,1^ALEX,54.0,03-26,2013,3,Alexandra Bridge
85,2013-03-27 00:00:00,2013-03-27,1^ALEX,66.0,03-27,2013,3,Alexandra Bridge
86,2013-03-28 00:00:00,2013-03-28,1^ALEX,86.0,03-28,2013,3,Alexandra Bridge
87,2013-03-29 00:00:00,2013-03-29,1^ALEX,55.0,03-29,2013,3,Alexandra Bridge
88,2013-03-30 00:00:00,2013-03-30,1^ALEX,92.0,03-30,2013,3,Alexandra Bridge
89,2013-03-31 00:00:00,2013-03-31,1^ALEX,118.0,03-31,2013,3,Alexandra Bridge
90,2013-04-01 00:00:00,2013-04-01,1^ALEX,94.0,04-01,2013,4,Alexandra Bridge
91,2013-04-02 00:00:00,2013-04-02,1^ALEX,235.0,04-02,2013,4,Alexandra Bridge
92,2013-04-03 00:00:00,2013-04-03,1^ALEX,317.0,04-03,2013,4,Alexandra Bridge
93,2013-04-04 00:00:00,2013-04-04,1^ALEX,510.0,04-04,2013,4,Alexandra Bridge
94,2013-04-05 00:00:00,2013-04-05,1^ALEX,503.0,04-05,2013,4,Alexandra Bridge
95,2013-04-06 00:00:00,2013-04-06,1^ALEX,333.0,04-06,2013,4,Alexandra Bridge
96,2013-04-07 00:00:00,2013-04-07,1^ALEX,181.0,04-07,2013,4,Alexandra Bridge
97,2013-04-08 00:00:00,2013-04-08,1^ALEX,797.0,04-08,2013,4,Alexandra Bridge
98,2013-04-09 00:00:00,2013-04-09,1^ALEX,735.0,04-09,2013,4,Alexandra Bridge
99,2013-04-10 00:00:00,2013-04-10,1^ALEX,876.0,04-10,2013,4,Alexandra Bridge
100,2013-04-11 00:00:00,2013-04-11,1^ALEX,618.0,04-11,2013,4,Alexandra Bridge
101,2013-04-12 00:00:00,2013-04-12,1^ALEX,57.0,04-12,2013,4,Alexandra Bridge
102,2013-04-13 00:00:00,2013-04-13,1^ALEX,122.0,04-13,2013,4,Alexandra Bridge
103,2013-04-14 00:00:00,2013-04-14,1^ALEX,256.0,04-14,2013,4,Alexandra Bridge
104,2013-04-15 00:00:00,2013-04-15,1^ALEX,986.0,04-15,2013,4,Alexandra Bridge
105,2013-04-16 00:00:00,2013-04-16,1^ALEX,606.0,04-16,2013,4,Alexandra Bridge
106,2013-04-17 00:00:00,2013-04-17,1^ALEX,1195.0,04-17,2013,4,Alexandra Bridge
107,2013-04-18 00:00:00,2013-04-18,1^ALEX,706.0,04-18,2013,4,Alexandra Bridge
108,2013-04-19 00:00:00,2013-04-19,1^ALEX,727.0,04-19,2013,4,Alexandra Bridge
109,2013-04-20 00:00:00,2013-04-20,1^ALEX,297.0,04-20,2013,4,Alexandra Bridge
110,2013-04-21 00:00:00,2013-04-21,1^ALEX,588.0,04-21,2013,4,Alexandra Bridge
111,2013-04-22 00:00:00,2013-04-22,1^ALEX,1238.0,04-22,2013,4,Alexandra Bridge
112,2013-04-23 00:00:00,2013-04-23,1^ALEX,1445.0,04-23,2013,4,Alexandra Bridge
113,2013-04-24 00:00:00,2013-04-24,1^ALEX,808.0,04-24,2013,4,Alexandra Bridge
114,2013-04-25 00:00:00,2013-04-25,1^ALEX,1311.0,04-25,2013,4,Alexandra Bridge
115,2013-04-26 00:00:00,2013-04-26,1^ALEX,934.0,04-26,2013,4,Alexandra Bridge
116,2013-04-27 00:00:00,2013-04-27,1^ALEX,608.0,04-27,2013,4,Alexandra Bridge
117,2013-04-28 00:00:00,2013-04-28,1^ALEX,1774.0,04-28,2013,4,Alexandra Bridge
118,2013-04-29 00:00:00,2013-04-29,1^ALEX,1177.0,04-29,2013,4,Alexandra Bridge
119,2013-04-30 00:00:00,2013-04-30,1^ALEX,1009.0,04-30,2013,4,Alexandra Bridge
120,2013-05-01 00:00:00,2013-05-01,1^ALEX,2023.0,05-01,2013,5,Alexandra Bridge
121,2013-05-02 00:00:00,2013-05-02,1^ALEX,2173.0,05-02,2013,5,Alexandra Bridge
122,2013-05-03 00:00:00,2013-05-03,1^ALEX,2113.0,05-03,2013,5,Alexandra Bridge
123,2013-05-04 00:00:00,2013-05-04,1^ALEX,1733.0,05-04,2013,5,Alexandra Bridge
124,2013-05-05 00:00:00,2013-05-05,1^ALEX,1929.0,05-05,2013,5,Alexandra Bridge
125,2013-05-06 00:00:00,2013-05-06,1^ALEX,2083.0,05-06,2013,5,Alexandra Bridge
126,2013-05-07 00:00:00,2013-05-07,1^ALEX,2357.0,05-07,2013,5,Alexandra Bridge
127,2013-05-08 00:00:00,2013-05-08,1^ALEX,2483.0,05-08,2013,5,Alexandra Bridge
128,2013-05-09 00:00:00,2013-05-09,1^ALEX,1927.0,05-09,2013,5,Alexandra Bridge
129,2013-05-10 00:00:00,2013-05-10,1^ALEX,1332.0,05-10,2013,5,Alexandra Bridge
130,2013-05-11 00:00:00,2013-05-11,1^ALEX,675.0,05-11,2013,5,Alexandra Bridge
131,2013-05-12 00:00:00,2013-05-12,1^ALEX,698.0,05-12,2013,5,Alexandra Bridge
132,2013-05-13 00:00:00,2013-05-13,1^ALEX,1166.0,05-13,2013,5,Alexandra Bridge
133,2013-05-14 00:00:00,2013-05-14,1^ALEX,1778.0,05-14,2013,5,Alexandra Bridge
134,2013-05-15 00:00:00,2013-05-15,1^ALEX,1535.0,05-15,2013,5,Alexandra Bridge
135,2013-05-16 00:00:00,2013-05-16,1^ALEX,2125.0,05-16,2013,5,Alexandra Bridge
136,2013-05-17 00:00:00,2013-05-17,1^ALEX,2068.0,05-17,2013,5,Alexandra Bridge
137,2013-05-18 00:00:00,2013-05-18,1^ALEX,2224.0,05-18,2013,5,Alexandra Bridge
138,2013-05-19 00:00:00,2013-05-19,1^ALEX,1430.0,05-19,2013,5,Alexandra Bridge
139,2013-05-20 00:00:00,2013-05-20,1^ALEX,1823.0,05-20,2013,5,Alexandra Bridge
140,2013-05-21 00:00:00,2013-05-21,1^ALEX,1270.0,05-21,2013,5,Alexandra Bridge
141,2013-05-22 00:00:00,2013-05-22,1^ALEX,1257.0,05-22,2013,5,Alexandra Bridge
142,2013-05-23 00:00:00,2013-05-23,1^ALEX,1288.0,05-23,2013,5,Alexandra Bridge
143,2013-05-24 00:00:00,2013-05-24,1^ALEX,889.0,05-24,2013,5,Alexandra Bridge
144,2013-05-25 00:00:00,2013-05-25,1^ALEX,1089.0,05-25,2013,5,Alexandra Bridge
145,2013-05-26 00:00:00,2013-05-26,1^ALEX,1417.0,05-26,2013,5,Alexandra Bridge
146,2013-05-27 00:00:00,2013-05-27,1^ALEX,2330.0,05-27,2013,5,Alexandra Bridge
147,2013-05-28 00:00:00,2013-05-28,1^ALEX,2354.0,05-28,2013,5,Alexandra Bridge
148,2013-05-29 00:00:00,2013-05-29,1^ALEX,875.0,05-29,2013,5,Alexandra Bridge
149,2013-05-30 00:00:00,2013-05-30,1^ALEX,2393.0,05-30,2013,5,Alexandra Bridge
150,2013-05-31 00:00:00,2013-05-31,1^ALEX,1788.0,05-31,2013,5,Alexandra Bridge
151,2013-06-01 00:00:00,2013-06-01,1^ALEX,796.0,06-01,2013,6,Alexandra Bridge
152,2013-06-02 00:00:00,2013-06-02,1^ALEX,735.0,06-02,2013,6,Alexandra Bridge
153,2013-06-03 00:00:00,2013-06-03,1^ALEX,2276.0,06-03,2013,6,Alexandra Bridge
154,2013-06-04 00:00:00,2013-06-04,1^ALEX,2701.0,06-04,2013,6,Alexandra Bridge
155,2013-06-05 00:00:00,2013-06-05,1^ALEX,2583.0,06-05,2013,6,Alexandra Bridge
156,2013-06-06 00:00:00,2013-06-06,1^ALEX,1139.0,06-06,2013,6,Alexandra Bridge
157,2013-06-07 00:00:00,2013-06-07,1^ALEX,580.0,06-07,2013,6,Alexandra Bridge
158,2013-06-08 00:00:00,2013-06-08,1^ALEX,639.0,06-08,2013,6,Alexandra Bridge
159,2013-06-09 00:00:00,2013-06-09,1^ALEX,2130.0,06-09,2013,6,Alexandra Bridge
160,2013-06-10 00:00:00,2013-06-10,1^ALEX,2022.0,06-10,2013,6,Alexandra Bridge
161,2013-06-11 00:00:00,2013-06-11,1^ALEX,546.0,06-11,2013,6,Alexandra Bridge
162,2013-06-12 00:00:00,2013-06-12,1^ALEX,2429.0,06-12,2013,6,Alexandra Bridge
163,2013-06-13 00:00:00,2013-06-13,1^ALEX,2221.0,06-13,2013,6,Alexandra Bridge
164,2013-06-14 00:00:00,2013-06-14,1^ALEX,2165.0,06-14,2013,6,Alexandra Bridge
165,2013-06-15 00:00:00,2013-06-15,1^ALEX,1851.0,06-15,2013,6,Alexandra Bridge
166,2013-06-16 00:00:00,2013-06-16,1^ALEX,380.0,06-16,2013,6,Alexandra Bridge
167,2013-06-17 00:00:00,2013-06-17,1^ALEX,1874.0,06-17,2013,6,Alexandra Bridge
168,2013-06-18 00:00:00,2013-06-18,1^ALEX,2441.0,06-18,2013,6,Alexandra Bridge
169,2013-06-19 00:00:00,2013-06-19,1^ALEX,2582.0,06-19,2013,6,Alexandra Bridge
170,2013-06-20 00:00:00,2013-06-20,1^ALEX,2493.0,06-20,2013,6,Alexandra Bridge
171,2013-06-21 00:00:00,2013-06-21,1^ALEX,2329.0,06-21,2013,6,Alexandra Bridge
172,2013-06-22 00:00:00,2013-06-22,1^ALEX,533.0,06-22,2013,6,Alexandra Bridge
173,2013-06-23 00:00:00,2013-06-23,1^ALEX,1362.0,06-23,2013,6,Alexandra Bridge
174,2013-06-24 00:00:00,2013-06-24,1^ALEX,1576.0,06-24,2013,6,Alexandra Bridge
175,2013-06-25 00:00:00,2013-06-25,1^ALEX,1930.0,06-25,2013,6,Alexandra Bridge
176,2013-06-26 00:00:00,2013-06-26,1^ALEX,2124.0,06-26,2013,6,Alexandra Bridge
177,2013-06-27 00:00:00,2013-06-27,1^ALEX,2285.0,06-27,2013,6,Alexandra Bridge
178,2013-06-28 00:00:00,2013-06-28,1^ALEX,564.0,06-28,2013,6,Alexandra Bridge
179,2013-06-29 00:00:00,2013-06-29,1^ALEX,1020.0,06-29,2013,6,Alexandra Bridge
180,2013-06-30 00:00:00,2013-06-30,1^ALEX,2748.0,06-30,2013,6,Alexandra Bridge
181,2013-07-01 00:00:00,2013-07-01,1^ALEX,611.0,07-01,2013,7,Alexandra Bridge
182,2013-07-02 00:00:00,2013-07-02,1^ALEX,1459.0,07-02,2013,7,Alexandra Bridge
183,2013-07-03 00:00:00,2013-07-03,1^ALEX,2174.0,07-03,2013,7,Alexandra Bridge
184,2013-07-04 00:00:00,2013-07-04,1^ALEX,1913.0,07-04,2013,7,Alexandra Bridge
185,2013-07-05 00:00:00,2013-07-05,1^ALEX,1759.0,07-05,2013,7,Alexandra Bridge
186,2013-07-06 00:00:00,2013-07-06,1^ALEX,1541.0,07-06,2013,7,Alexandra Bridge
187,2013-07-07 00:00:00,2013-07-07,1^ALEX,1290.0,07-07,2013,7,Alexandra Bridge
188,2013-07-08 00:00:00,2013-07-08,1^ALEX,2139.0,07-08,2013,7,Alexandra Bridge
189,2013-07-09 00:00:00,2013-07-09,1^ALEX,2191.0,07-09,2013,7,Alexandra Bridge
190,2013-07-10 00:00:00,2013-07-10,1^ALEX,1606.0,07-10,2013,7,Alexandra Bridge
191,2013-07-11 00:00:00,2013-07-11,1^ALEX,2435.0,07-11,2013,7,Alexandra Bridge
192,2013-07-12 00:00:00,2013-07-12,1^ALEX,2116.0,07-12,2013,7,Alexandra Bridge
193,2013-07-13 00:00:00,2013-07-13,1^ALEX,1867.0,07-13,2013,7,Alexandra Bridge
194,2013-07-14 00:00:00,2013-07-14,1^ALEX,1767.0,07-14,2013,7,Alexandra Bridge
195,2013-07-15 00:00:00,2013-07-15,1^ALEX,1825.0,07-15,2013,7,Alexandra Bridge
196,2013-07-16 00:00:00,2013-07-16,1^ALEX,2063.0,07-16,2013,7,Alexandra Bridge
197,2013-07-17 00:00:00,2013-07-17,1^ALEX,1755.0,07-17,2013,7,Alexandra Bridge
198,2013-07-18 00:00:00,2013-07-18,1^ALEX,1849.0,07-18,2013,7,Alexandra Bridge
199,2013-07-19 00:00:00,2013-07-19,1^ALEX,1340.0,07-19,2013,7,Alexandra Bridge
200,2013-07-20 00:00:00,2013-07-20,1^ALEX,1477.0,07-20,2013,7,Alexandra Bridge
201,2013-07-21 00:00:00,2013-07-21,1^ALEX,2397.0,07-21,2013,7,Alexandra Bridge
202,2013-07-22 00:00:00,2013-07-22,1^ALEX,2228.0,07-22,2013,7,Alexandra Bridge
203,2013-07-23 00:00:00,2013-07-23,1^ALEX,2035.0,07-23,2013,7,Alexandra Bridge
204,2013-07-24 00:00:00,2013-07-24,1^ALEX,2038.0,07-24,2013,7,Alexandra Bridge
205,2013-07-25 00:00:00,2013-07-25,1^ALEX,2397.0,07-25,2013,7,Alexandra Bridge
206,2013-07-26 00:00:00,2013-07-26,1^ALEX,2074.0,07-26,2013,7,Alexandra Bridge
207,2013-07-27 00:00:00,2013-07-27,1^ALEX,1626.0,07-27,2013,7,Alexandra Bridge
208,2013-07-28 00:00:00,2013-07-28,1^ALEX,772.0,07-28,2013,7,Alexandra Bridge
209,2013-07-29 00:00:00,2013-07-29,1^ALEX,1704.0,07-29,2013,7,Alexandra Bridge
210,2013-07-30 00:00:00,2013-07-30,1^ALEX,2530.0,07-30,2013,7,Alexandra Bridge
211,2013-07-31 00:00:00,2013-07-31,1^ALEX,2466.0,07-31,2013,7,Alexandra Bridge
212,2013-08-01 00:00:00,2013-08-01,1^ALEX,1076.0,08-01,2013,8,Alexandra Bridge
213,2013-08-02 00:00:00,2013-08-02,1^ALEX,1691.0,08-02,2013,8,Alexandra Bridge
214,2013-08-03 00:00:00,2013-08-03,1^ALEX,1403.0,08-03,2013,8,Alexandra Bridge
215,2013-08-04 00:00:00,2013-08-04,1^ALEX,1489.0,08-04,2013,8,Alexandra Bridge
216,2013-08-05 00:00:00,2013-08-05,1^ALEX,2337.0,08-05,2013,8,Alexandra Bridge
217,2013-08-06 00:00:00,2013-08-06,1^ALEX,2304.0,08-06,2013,8,Alexandra Bridge
218,2013-08-07 00:00:00,2013-08-07,1^ALEX,1768.0,08-07,2013,8,Alexandra Bridge
219,2013-08-08 00:00:00,2013-08-08,1^ALEX,2083.0,08-08,2013,8,Alexandra Bridge
220,2013-08-09 00:00:00,2013-08-09,1^ALEX,1899.0,08-09,2013,8,Alexandra Bridge
221,2013-08-10 00:00:00,2013-08-10,1^ALEX,1789.0,08-10,2013,8,Alexandra Bridge
222,2013-08-11 00:00:00,2013-08-11,1^ALEX,2161.0,08-11,2013,8,Alexandra Bridge
223,2013-08-12 00:00:00,2013-08-12,1^ALEX,2106.0,08-12,2013,8,Alexandra Bridge
224,2013-08-13 00:00:00,2013-08-13,1^ALEX,1608.0,08-13,2013,8,Alexandra Bridge
225,2013-08-14 00:00:00,2013-08-14,1^ALEX,1823.0,08-14,2013,8,Alexandra Bridge
226,2013-08-15 00:00:00,2013-08-15,1^ALEX,2307.0,08-15,2013,8,Alexandra Bridge
227,2013-08-16 00:00:00,2013-08-16,1^ALEX,1911.0,08-16,2013,8,Alexandra Bridge
228,2013-08-17 00:00:00,2013-08-17,1^ALEX,1828.0,08-17,2013,8,Alexandra Bridge
229,2013-08-18 00:00:00,2013-08-18,1^ALEX,2031.0,08-18,2013,8,Alexandra Bridge
230,2013-08-19 00:00:00,2013-08-19,1^ALEX,2031.0,08-19,2013,8,Alexandra Bridge
231,2013-08-20 00:00:00,2013-08-20,1^ALEX,2183.0,08-20,2013,8,Alexandra Bridge
232,2013-08-21 00:00:00,2013-08-21,1^ALEX,2162.0,08-21,2013,8,Alexandra Bridge
233,2013-08-22 00:00:00,2013-08-22,1^ALEX,975.0,08-22,2013,8,Alexandra Bridge
234,2013-08-23 00:00:00,2013-08-23,1^ALEX,1970.0,08-23,2013,8,Alexandra Bridge
235,2013-08-24 00:00:00,2013-08-24,1^ALEX,1552.0,08-24,2013,8,Alexandra Bridge
236,2013-08-25 00:00:00,2013-08-25,1^ALEX,1649.0,08-25,2013,8,Alexandra Bridge
237,2013-08-26 00:00:00,2013-08-26,1^ALEX,1440.0,08-26,2013,8,Alexandra Bridge
238,2013-08-27 00:00:00,2013-08-27,1^ALEX,1952.0,08-27,2013,8,Alexandra Bridge
239,2013-08-28 00:00:00,2013-08-28,1^ALEX,1843.0,08-28,2013,8,Alexandra Bridge
240,2013-08-29 00:00:00,2013-08-29,1^ALEX,2201.0,08-29,2013,8,Alexandra Bridge
241,2013-08-30 00:00:00,2013-08-30,1^ALEX,1580.0,08-30,2013,8,Alexandra Bridge
242,2013-08-31 00:00:00,2013-08-31,1^ALEX,1321.0,08-31,2013,8,Alexandra Bridge
243,2013-09-01 00:00:00,2013-09-01,1^ALEX,2078.0,09-01,2013,9,Alexandra Bridge
244,2013-09-02 00:00:00,2013-09-02,1^ALEX,1103.0,09-02,2013,9,Alexandra Bridge
245,2013-09-03 00:00:00,2013-09-03,1^ALEX,1499.0,09-03,2013,9,Alexandra Bridge
246,2013-09-04 00:00:00,2013-09-04,1^ALEX,1987.0,09-04,2013,9,Alexandra Bridge
247,2013-09-05 00:00:00,2013-09-05,1^ALEX,1994.0,09-05,2013,9,Alexandra Bridge
248,2013-09-06 00:00:00,2013-09-06,1^ALEX,1937.0,09-06,2013,9,Alexandra Bridge
249,2013-09-07 00:00:00,2013-09-07,1^ALEX,776.0,09-07,2013,9,Alexandra Bridge
250,2013-09-08 00:00:00,2013-09-08,1^ALEX,1463.0,09-08,2013,9,Alexandra Bridge
251,2013-09-09 00:00:00,2013-09-09,1^ALEX,2017.0,09-09,2013,9,Alexandra Bridge
252,2013-09-10 00:00:00,2013-09-10,1^ALEX,1043.0,09-10,2013,9,Alexandra Bridge
253,2013-09-11 00:00:00,2013-09-11,1^ALEX,1829.0,09-11,2013,9,Alexandra Bridge
254,2013-09-12 00:00:00,2013-09-12,1^ALEX,1335.0,09-12,2013,9,Alexandra Bridge
255,2013-09-13 00:00:00,2013-09-13,1^ALEX,1495.0,09-13,2013,9,Alexandra Bridge
256,2013-09-14 00:00:00,2013-09-14,1^ALEX,1192.0,09-14,2013,9,Alexandra Bridge
257,2013-09-15 00:00:00,2013-09-15,1^ALEX,1048.0,09-15,2013,9,Alexandra Bridge
258,2013-09-16 00:00:00,2013-09-16,1^ALEX,1649.0,09-16,2013,9,Alexandra Bridge
259,2013-09-17 00:00:00,2013-09-17,1^ALEX,2051.0,09-17,2013,9,Alexandra Bridge
260,2013-09-18 00:00:00,2013-09-18,1^ALEX,2243.0,09-18,2013,9,Alexandra Bridge
261,2013-09-19 00:00:00,2013-09-19,1^ALEX,2255.0,09-19,2013,9,Alexandra Bridge
262,2013-09-20 00:00:00,2013-09-20,1^ALEX,2049.0,09-20,2013,9,Alexandra Bridge
263,2013-09-21 00:00:00,2013-09-21,1^ALEX,317.0,09-21,2013,9,Alexandra Bridge
264,2013-09-22 00:00:00,2013-09-22,1^ALEX,689.0,09-22,2013,9,Alexandra Bridge
265,2013-09-23 00:00:00,2013-09-23,1^ALEX,1819.0,09-23,2013,9,Alexandra Bridge
266,2013-09-24 00:00:00,2013-09-24,1^ALEX,2002.0,09-24,2013,9,Alexandra Bridge
267,2013-09-25 00:00:00,2013-09-25,1^ALEX,2144.0,09-25,2013,9,Alexandra Bridge
268,2013-09-26 00:00:00,2013-09-26,1^ALEX,1976.0,09-26,2013,9,Alexandra Bridge
269,2013-09-27 00:00:00,2013-09-27,1^ALEX,1907.0,09-27,2013,9,Alexandra Bridge
270,2013-09-28 00:00:00,2013-09-28,1^ALEX,39.0,09-28,2013,9,Alexandra Bridge
271,2013-09-29 00:00:00,2013-09-29,1^ALEX,1107.0,09-29,2013,9,Alexandra Bridge
272,2013-09-30 00:00:00,2013-09-30,1^ALEX,1873.0,09-30,2013,9,Alexandra Bridge
273,2013-10-01 00:00:00,2013-10-01,1^ALEX,1992.0,10-01,2013,10,Alexandra Bridge
274,2013-10-02 00:00:00,2013-10-02,1^ALEX,2024.0,10-02,2013,10,Alexandra Bridge
275,2013-10-03 00:00:00,2013-10-03,1^ALEX,2114.0,10-03,2013,10,Alexandra Bridge
276,2013-10-04 00:00:00,2013-10-04,1^ALEX,1399.0,10-04,2013,10,Alexandra Bridge
277,2013-10-05 00:00:00,2013-10-05,1^ALEX,1139.0,10-05,2013,10,Alexandra Bridge
278,2013-10-06 00:00:00,2013-10-06,1^ALEX,334.0,10-06,2013,10,Alexandra Bridge
279,2013-10-07 00:00:00,2013-10-07,1^ALEX,992.0,10-07,2013,10,Alexandra Bridge
280,2013-10-08 00:00:00,2013-10-08,1^ALEX,1699.0,10-08,2013,10,Alexandra Bridge
281,2013-10-09 00:00:00,2013-10-09,1^ALEX,1916.0,10-09,2013,10,Alexandra Bridge
282,2013-10-10 00:00:00,2013-10-10,1^ALEX,1898.0,10-10,2013,10,Alexandra Bridge
283,2013-10-11 00:00:00,2013-10-11,1^ALEX,1754.0,10-11,2013,10,Alexandra Bridge
284,2013-10-12 00:00:00,2013-10-12,1^ALEX,1318.0,10-12,2013,10,Alexandra Bridge
285,2013-10-13 00:00:00,2013-10-13,1^ALEX,999.0,10-13,2013,10,Alexandra Bridge
286,2013-10-14 00:00:00,2013-10-14,1^ALEX,964.0,10-14,2013,10,Alexandra Bridge
287,2013-10-15 00:00:00,2013-10-15,1^ALEX,1525.0,10-15,2013,10,Alexandra Bridge
288,2013-10-16 00:00:00,2013-10-16,1^ALEX,1040.0,10-16,2013,10,Alexandra Bridge
289,2013-10-17 00:00:00,2013-10-17,1^ALEX,1478.0,10-17,2013,10,Alexandra Bridge
290,2013-10-18 00:00:00,2013-10-18,1^ALEX,1038.0,10-18,2013,10,Alexandra Bridge
291,2013-10-19 00:00:00,2013-10-19,1^ALEX,391.0,10-19,2013,10,Alexandra Bridge
292,2013-10-20 00:00:00,2013-10-20,1^ALEX,632.0,10-20,2013,10,Alexandra Bridge
293,2013-10-21 00:00:00,2013-10-21,1^ALEX,1015.0,10-21,2013,10,Alexandra Bridge
294,2013-10-22 00:00:00,2013-10-22,1^ALEX,1374.0,10-22,2013,10,Alexandra Bridge
295,2013-10-23 00:00:00,2013-10-23,1^ALEX,1412.0,10-23,2013,10,Alexandra Bridge
296,2013-10-24 00:00:00,2013-10-24,1^ALEX,1219.0,10-24,2013,10,Alexandra Bridge
297,2013-10-25 00:00:00,2013-10-25,1^ALEX,1116.0,10-25,2013,10,Alexandra Bridge
298,2013-10-26 00:00:00,2013-10-26,1^ALEX,207.0,10-26,2013,10,Alexandra Bridge
299,2013-10-27 00:00:00,2013-10-27,1^ALEX,358.0,10-27,2013,10,Alexandra Bridge
300,2013-10-28 00:00:00,2013-10-28,1^ALEX,1043.0,10-28,2013,10,Alexandra Bridge
301,2013-10-29 00:00:00,2013-10-29,1^ALEX,1150.0,10-29,2013,10,Alexandra Bridge
302,2013-10-30 00:00:00,2013-10-30,1^ALEX,1127.0,10-30,2013,10,Alexandra Bridge
303,2013-10-31 00:00:00,2013-10-31,1^ALEX,733.0,10-31,2013,10,Alexandra Bridge
304,2013-11-01 00:00:00,2013-11-01,1^ALEX,694.0,11-01,2013,11,Alexandra Bridge
305,2013-11-02 00:00:00,2013-11-02,1^ALEX,323.0,11-02,2013,11,Alexandra Bridge
306,2013-11-03 00:00:00,2013-11-03,1^ALEX,359.0,11-03,2013,11,Alexandra Bridge
307,2013-11-04 00:00:00,2013-11-04,1^ALEX,966.0,11-04,2013,11,Alexandra Bridge
308,2013-11-05 00:00:00,2013-11-05,1^ALEX,1039.0,11-05,2013,11,Alexandra Bridge
309,2013-11-06 00:00:00,2013-11-06,1^ALEX,967.0,11-06,2013,11,Alexandra Bridge
310,2013-11-07 00:00:00,2013-11-07,1^ALEX,981.0,11-07,2013,11,Alexandra Bridge
311,2013-11-08 00:00:00,2013-11-08,1^ALEX,842.0,11-08,2013,11,Alexandra Bridge
312,2013-11-09 00:00:00,2013-11-09,1^ALEX,281.0,11-09,2013,11,Alexandra Bridge
313,2013-11-10 00:00:00,2013-11-10,1^ALEX,131.0,11-10,2013,11,Alexandra Bridge
314,2013-11-11 00:00:00,2013-11-11,1^ALEX,307.0,11-11,2013,11,Alexandra Bridge
315,2013-11-12 00:00:00,2013-11-12,1^ALEX,668.0,11-12,2013,11,Alexandra Bridge
316,2013-11-13 00:00:00,2013-11-13,1^ALEX,645.0,11-13,2013,11,Alexandra Bridge
317,2013-11-14 00:00:00,2013-11-14,1^ALEX,845.0,11-14,2013,11,Alexandra Bridge
318,2013-11-15 00:00:00,2013-11-15,1^ALEX,782.0,11-15,2013,11,Alexandra Bridge
319,2013-11-16 00:00:00,2013-11-16,1^ALEX,491.0,11-16,2013,11,Alexandra Bridge
320,2013-11-17 00:00:00,2013-11-17,1^ALEX,182.0,11-17,2013,11,Alexandra Bridge
321,2013-11-18 00:00:00,2013-11-18,1^ALEX,550.0,11-18,2013,11,Alexandra Bridge
322,2013-11-19 00:00:00,2013-11-19,1^ALEX,675.0,11-19,2013,11,Alexandra Bridge
323,2013-11-20 00:00:00,2013-11-20,1^ALEX,729.0,11-20,2013,11,Alexandra Bridge
324,2013-11-21 00:00:00,2013-11-21,1^ALEX,733.0,11-21,2013,11,Alexandra Bridge
325,2013-11-22 00:00:00,2013-11-22,1^ALEX,431.0,11-22,2013,11,Alexandra Bridge
326,2013-11-23 00:00:00,2013-11-23,1^ALEX,110.0,11-23,2013,11,Alexandra Bridge
327,2013-11-24 00:00:00,2013-11-24,1^ALEX,46.0,11-24,2013,11,Alexandra Bridge
328,2013-11-25 00:00:00,2013-11-25,1^ALEX,460.0,11-25,2013,11,Alexandra Bridge
329,2013-11-26 00:00:00,2013-11-26,1^ALEX,704.0,11-26,2013,11,Alexandra Bridge
330,2013-11-27 00:00:00,2013-11-27,1^ALEX,729.0,11-27,2013,11,Alexandra Bridge
331,2013-11-28 00:00:00,2013-11-28,1^ALEX,826.0,11-28,2013,11,Alexandra Bridge
332,2013-11-29 00:00:00,2013-11-29,1^ALEX,649.0,11-29,2013,11,Alexandra Bridge
333,2013-11-30 00:00:00,2013-11-30,1^ALEX,341.0,11-30,2013,11,Alexandra Bridge
334,2013-12-01 00:00:00,2013-12-01,1^ALEX,,12-01,2013,12,Alexandra Bridge
335,2013-12-02 00:00:00,2013-12-02,1^ALEX,,12-02,2013,12,Alexandra Bridge
336,2013-12-03 00:00:00,2013-12-03,1^ALEX,,12-03,2013,12,Alexandra Bridge
337,2013-12-04 00:00:00,2013-12-04,1^ALEX,,12-04,2013,12,Alexandra Bridge
338,2013-12-05 00:00:00,2013-12-05,1^ALEX,,12-05,2013,12,Alexandra Bridge
339,2013-12-06 00:00:00,2013-12-06,1^ALEX,,12-06,2013,12,Alexandra Bridge
340,2013-12-07 00:00:00,2013-12-07,1^ALEX,,12-07,2013,12,Alexandra Bridge
341,2013-12-08 00:00:00,2013-12-08,1^ALEX,,12-08,2013,12,Alexandra Bridge
342,2013-12-09 00:00:00,2013-12-09,1^ALEX,,12-09,2013,12,Alexandra Bridge
343,2013-12-10 00:00:00,2013-12-10,1^ALEX,,12-10,2013,12,Alexandra Bridge
344,2013-12-11 00:00:00,2013-12-11,1^ALEX,,12-11,2013,12,Alexandra Bridge
345,2013-12-12 00:00:00,2013-12-12,1^ALEX,,12-12,2013,12,Alexandra Bridge
346,2013-12-13 00:00:00,2013-12-13,1^ALEX,,12-13,2013,12,Alexandra Bridge
347,2013-12-14 00:00:00,2013-12-14,1^ALEX,,12-14,2013,12,Alexandra Bridge
348,2013-12-15 00:00:00,2013-12-15,1^ALEX,,12-15,2013,12,Alexandra Bridge
349,2013-12-16 00:00:00,2013-12-16,1^ALEX,,12-16,2013,12,Alexandra Bridge
350,2013-12-17 00:00:00,2013-12-17,1^ALEX,,12-17,2013,12,Alexandra Bridge
351,2013-12-18 00:00:00,2013-12-18,1^ALEX,,12-18,2013,12,Alexandra Bridge
352,2013-12-19 00:00:00,2013-12-19,1^ALEX,,12-19,2013,12,Alexandra Bridge
353,2013-12-20 00:00:00,2013-12-20,1^ALEX,,12-20,2013,12,Alexandra Bridge
354,2013-12-21 00:00:00,2013-12-21,1^ALEX,,12-21,2013,12,Alexandra Bridge
355,2013-12-22 00:00:00,2013-12-22,1^ALEX,,12-22,2013,12,Alexandra Bridge
356,2013-12-23 00:00:00,2013-12-23,1^ALEX,,12-23,2013,12,Alexandra Bridge
357,2013-12-24 00:00:00,2013-12-24,1^ALEX,,12-24,2013,12,Alexandra Bridge
358,2013-12-25 00:00:00,2013-12-25,1^ALEX,,12-25,2013,12,Alexandra Bridge
359,2013-12-26 00:00:00,2013-12-26,1^ALEX,,12-26,2013,12,Alexandra Bridge
360,2013-12-27 00:00:00,2013-12-27,1^ALEX,,12-27,2013,12,Alexandra Bridge
361,2013-12-28 00:00:00,2013-12-28,1^ALEX,,12-28,2013,12,Alexandra Bridge
362,2013-12-29 00:00:00,2013-12-29,1^ALEX,,12-29,2013,12,Alexandra Bridge
363,2013-12-30 00:00:00,2013-12-30,1^ALEX,,12-30,2013,12,Alexandra Bridge
364,2013-12-31 00:00:00,2013-12-31,1^ALEX,,12-31,2013,12,Alexandra Bridge
365,2014-01-01 00:00:00,2014-01-01,1^ALEX,,01-01,2014,1,Alexandra Bridge
366,2014-01-02 00:00:00,2014-01-02,1^ALEX,,01-02,2014,1,Alexandra Bridge
367,2014-01-03 00:00:00,2014-01-03,1^ALEX,,01-03,2014,1,Alexandra Bridge
368,2014-01-04 00:00:00,2014-01-04,1^ALEX,,01-04,2014,1,Alexandra Bridge
369,2014-01-05 00:00:00,2014-01-05,1^ALEX,,01-05,2014,1,Alexandra Bridge
370,2014-01-06 00:00:00,2014-01-06,1^ALEX,,01-06,2014,1,Alexandra Bridge
371,2014-01-07 00:00:00,2014-01-07,1^ALEX,,01-07,2014,1,Alexandra Bridge
372,2014-01-08 00:00:00,2014-01-08,1^ALEX,,01-08,2014,1,Alexandra Bridge
373,2014-01-09 00:00:00,2014-01-09,1^ALEX,,01-09,2014,1,Alexandra Bridge
374,2014-01-10 00:00:00,2014-01-10,1^ALEX,,01-10,2014,1,Alexandra Bridge
375,2014-01-11 00:00:00,2014-01-11,1^ALEX,,01-11,2014,1,Alexandra Bridge
376,2014-01-12 00:00:00,2014-01-12,1^ALEX,,01-12,2014,1,Alexandra Bridge
377,2014-01-13 00:00:00,2014-01-13,1^ALEX,,01-13,2014,1,Alexandra Bridge
378,2014-01-14 00:00:00,2014-01-14,1^ALEX,,01-14,2014,1,Alexandra Bridge
379,2014-01-15 00:00:00,2014-01-15,1^ALEX,,01-15,2014,1,Alexandra Bridge
380,2014-01-16 00:00:00,2014-01-16,1^ALEX,,01-16,2014,1,Alexandra Bridge
381,2014-01-17 00:00:00,2014-01-17,1^ALEX,,01-17,2014,1,Alexandra Bridge
382,2014-01-18 00:00:00,2014-01-18,1^ALEX,,01-18,2014,1,Alexandra Bridge
383,2014-01-19 00:00:00,2014-01-19,1^ALEX,,01-19,2014,1,Alexandra Bridge
384,2014-01-20 00:00:00,2014-01-20,1^ALEX,,01-20,2014,1,Alexandra Bridge
385,2014-01-21 00:00:00,2014-01-21,1^ALEX,,01-21,2014,1,Alexandra Bridge
386,2014-01-22 00:00:00,2014-01-22,1^ALEX,,01-22,2014,1,Alexandra Bridge
387,2014-01-23 00:00:00,2014-01-23,1^ALEX,,01-23,2014,1,Alexandra Bridge
388,2014-01-24 00:00:00,2014-01-24,1^ALEX,,01-24,2014,1,Alexandra Bridge
389,2014-01-25 00:00:00,2014-01-25,1^ALEX,,01-25,2014,1,Alexandra Bridge
390,2014-01-26 00:00:00,2014-01-26,1^ALEX,,01-26,2014,1,Alexandra Bridge
391,2014-01-27 00:00:00,2014-01-27,1^ALEX,,01-27,2014,1,Alexandra Bridge
392,2014-01-28 00:00:00,2014-01-28,1^ALEX,,01-28,2014,1,Alexandra Bridge
393,2014-01-29 00:00:00,2014-01-29,1^ALEX,,01-29,2014,1,Alexandra Bridge
394,2014-01-30 00:00:00,2014-01-30,1^ALEX,,01-30,2014,1,Alexandra Bridge
395,2014-01-31 00:00:00,2014-01-31,1^ALEX,,01-31,2014,1,Alexandra Bridge
396,2014-02-01 00:00:00,2014-02-01,1^ALEX,,02-01,2014,2,Alexandra Bridge
397,2014-02-02 00:00:00,2014-02-02,1^ALEX,,02-02,2014,2,Alexandra Bridge
398,2014-02-03 00:00:00,2014-02-03,1^ALEX,,02-03,2014,2,Alexandra Bridge
399,2014-02-04 00:00:00,2014-02-04,1^ALEX,,02-04,2014,2,Alexandra Bridge
400,2014-02-05 00:00:00,2014-02-05,1^ALEX,,02-05,2014,2,Alexandra Bridge
401,2014-02-06 00:00:00,2014-02-06,1^ALEX,,02-06,2014,2,Alexandra Bridge
402,2014-02-07 00:00:00,2014-02-07,1^ALEX,,02-07,2014,2,Alexandra Bridge
403,2014-02-08 00:00:00,2014-02-08,1^ALEX,,02-08,2014,2,Alexandra Bridge
404,2014-02-09 00:00:00,2014-02-09,1^ALEX,,02-09,2014,2,Alexandra Bridge
405,2014-02-10 00:00:00,2014-02-10,1^ALEX,,02-10,2014,2,Alexandra Bridge
406,2014-02-11 00:00:00,2014-02-11,1^ALEX,,02-11,2014,2,Alexandra Bridge
407,2014-02-12 00:00:00,2014-02-12,1^ALEX,,02-12,2014,2,Alexandra Bridge
408,2014-02-13 00:00:00,2014-02-13,1^ALEX,,02-13,2014,2,Alexandra Bridge
409,2014-02-14 00:00:00,2014-02-14,1^ALEX,,02-14,2014,2,Alexandra Bridge
410,2014-02-15 00:00:00,2014-02-15,1^ALEX,,02-15,2014,2,Alexandra Bridge
411,2014-02-16 00:00:00,2014-02-16,1^ALEX,,02-16,2014,2,Alexandra Bridge
412,2014-02-17 00:00:00,2014-02-17,1^ALEX,,02-17,2014,2,Alexandra Bridge
413,2014-02-18 00:00:00,2014-02-18,1^ALEX,,02-18,2014,2,Alexandra Bridge
414,2014-02-19 00:00:00,2014-02-19,1^ALEX,,02-19,2014,2,Alexandra Bridge
415,2014-02-20 00:00:00,2014-02-20,1^ALEX,,02-20,2014,2,Alexandra Bridge
416,2014-02-21 00:00:00,2014-02-21,1^ALEX,,02-21,2014,2,Alexandra Bridge
417,2014-02-22 00:00:00,2014-02-22,1^ALEX,,02-22,2014,2,Alexandra Bridge
418,2014-02-23 00:00:00,2014-02-23,1^ALEX,,02-23,2014,2,Alexandra Bridge
419,2014-02-24 00:00:00,2014-02-24,1^ALEX,,02-24,2014,2,Alexandra Bridge
420,2014-02-25 00:00:00,2014-02-25,1^ALEX,,02-25,2014,2,Alexandra Bridge
421,2014-02-26 00:00:00,2014-02-26,1^ALEX,,02-26,2014,2,Alexandra Bridge
422,2014-02-27 00:00:00,2014-02-27,1^ALEX,,02-27,2014,2,Alexandra Bridge
423,2014-02-28 00:00:00,2014-02-28,1^ALEX,,02-28,2014,2,Alexandra Bridge
424,2014-03-01 00:00:00,2014-03-01,1^ALEX,,03-01,2014,3,Alexandra Bridge
425,2014-03-02 00:00:00,2014-03-02,1^ALEX,,03-02,2014,3,Alexandra Bridge
426,2014-03-03 00:00:00,2014-03-03,1^ALEX,,03-03,2014,3,Alexandra Bridge
427,2014-03-04 00:00:00,2014-03-04,1^ALEX,,03-04,2014,3,Alexandra Bridge
428,2014-03-05 00:00:00,2014-03-05,1^ALEX,,03-05,2014,3,Alexandra Bridge
429,2014-03-06 00:00:00,2014-03-06,1^ALEX,,03-06,2014,3,Alexandra Bridge
430,2014-03-07 00:00:00,2014-03-07,1^ALEX,,03-07,2014,3,Alexandra Bridge
431,2014-03-08 00:00:00,2014-03-08,1^ALEX,,03-08,2014,3,Alexandra Bridge
432,2014-03-09 00:00:00,2014-03-09,1^ALEX,,03-09,2014,3,Alexandra Bridge
433,2014-03-10 00:00:00,2014-03-10,1^ALEX,,03-10,2014,3,Alexandra Bridge
434,2014-03-11 00:00:00,2014-03-11,1^ALEX,,03-11,2014,3,Alexandra Bridge
435,2014-03-12 00:00:00,2014-03-12,1^ALEX,,03-12,2014,3,Alexandra Bridge
436,2014-03-13 00:00:00,2014-03-13,1^ALEX,,03-13,2014,3,Alexandra Bridge
437,2014-03-14 00:00:00,2014-03-14,1^ALEX,,03-14,2014,3,Alexandra Bridge
438,2014-03-15 00:00:00,2014-03-15,1^ALEX,,03-15,2014,3,Alexandra Bridge
439,2014-03-16 00:00:00,2014-03-16,1^ALEX,,03-16,2014,3,Alexandra Bridge
440,2014-03-17 00:00:00,2014-03-17,1^ALEX,,03-17,2014,3,Alexandra Bridge
441,2014-03-18 00:00:00,2014-03-18,1^ALEX,,03-18,2014,3,Alexandra Bridge
442,2014-03-19 00:00:00,2014-03-19,1^ALEX,,03-19,2014,3,Alexandra Bridge
443,2014-03-20 00:00:00,2014-03-20,1^ALEX,,03-20,2014,3,Alexandra Bridge
444,2014-03-21 00:00:00,2014-03-21,1^ALEX,,03-21,2014,3,Alexandra Bridge
445,2014-03-22 00:00:00,2014-03-22,1^ALEX,,03-22,2014,3,Alexandra Bridge
446,2014-03-23 00:00:00,2014-03-23,1^ALEX,,03-23,2014,3,Alexandra Bridge
447,2014-03-24 00:00:00,2014-03-24,1^ALEX,,03-24,2014,3,Alexandra Bridge
448,2014-03-25 00:00:00,2014-03-25,1^ALEX,,03-25,2014,3,Alexandra Bridge
449,2014-03-26 00:00:00,2014-03-26,1^ALEX,,03-26,2014,3,Alexandra Bridge
450,2014-03-27 00:00:00,2014-03-27,1^ALEX,,03-27,2014,3,Alexandra Bridge
451,2014-03-28 00:00:00,2014-03-28,1^ALEX,,03-28,2014,3,Alexandra Bridge
452,2014-03-29 00:00:00,2014-03-29,1^ALEX,,03-29,2014,3,Alexandra Bridge
453,2014-03-30 00:00:00,2014-03-30,1^ALEX,,03-30,2014,3,Alexandra Bridge
454,2014-03-31 00:00:00,2014-03-31,1^ALEX,,03-31,2014,3,Alexandra Bridge
455,2014-04-01 00:00:00,2014-04-01,1^ALEX,0.0,04-01,2014,4,Alexandra Bridge
456,2014-04-02 00:00:00,2014-04-02,1^ALEX,0.0,04-02,2014,4,Alexandra Bridge
457,2014-04-03 00:00:00,2014-04-03,1^ALEX,0.0,04-03,2014,4,Alexandra Bridge
458,2014-04-04 00:00:00,2014-04-04,1^ALEX,0.0,04-04,2014,4,Alexandra Bridge
459,2014-04-05 00:00:00,2014-04-05,1^ALEX,0.0,04-05,2014,4,Alexandra Bridge
460,2014-04-06 00:00:00,2014-04-06,1^ALEX,0.0,04-06,2014,4,Alexandra Bridge
461,2014-04-07 00:00:00,2014-04-07,1^ALEX,0.0,04-07,2014,4,Alexandra Bridge
462,2014-04-08 00:00:00,2014-04-08,1^ALEX,0.0,04-08,2014,4,Alexandra Bridge
463,2014-04-09 00:00:00,2014-04-09,1^ALEX,112.0,04-09,2014,4,Alexandra Bridge
464,2014-04-10 00:00:00,2014-04-10,1^ALEX,662.0,04-10,2014,4,Alexandra Bridge
465,2014-04-11 00:00:00,2014-04-11,1^ALEX,749.0,04-11,2014,4,Alexandra Bridge
466,2014-04-12 00:00:00,2014-04-12,1^ALEX,481.0,04-12,2014,4,Alexandra Bridge
467,2014-04-13 00:00:00,2014-04-13,1^ALEX,188.0,04-13,2014,4,Alexandra Bridge
468,2014-04-14 00:00:00,2014-04-14,1^ALEX,641.0,04-14,2014,4,Alexandra Bridge
469,2014-04-15 00:00:00,2014-04-15,1^ALEX,262.0,04-15,2014,4,Alexandra Bridge
470,2014-04-16 00:00:00,2014-04-16,1^ALEX,515.0,04-16,2014,4,Alexandra Bridge
471,2014-04-17 00:00:00,2014-04-17,1^ALEX,726.0,04-17,2014,4,Alexandra Bridge
472,2014-04-18 00:00:00,2014-04-18,1^ALEX,434.0,04-18,2014,4,Alexandra Bridge
473,2014-04-19 00:00:00,2014-04-19,1^ALEX,593.0,04-19,2014,4,Alexandra Bridge
474,2014-04-20 00:00:00,2014-04-20,1^ALEX,771.0,04-20,2014,4,Alexandra Bridge
475,2014-04-21 00:00:00,2014-04-21,1^ALEX,583.0,04-21,2014,4,Alexandra Bridge
476,2014-04-22 00:00:00,2014-04-22,1^ALEX,510.0,04-22,2014,4,Alexandra Bridge
477,2014-04-23 00:00:00,2014-04-23,1^ALEX,982.0,04-23,2014,4,Alexandra Bridge
478,2014-04-24 00:00:00,2014-04-24,1^ALEX,1159.0,04-24,2014,4,Alexandra Bridge
479,2014-04-25 00:00:00,2014-04-25,1^ALEX,1064.0,04-25,2014,4,Alexandra Bridge
480,2014-04-26 00:00:00,2014-04-26,1^ALEX,183.0,04-26,2014,4,Alexandra Bridge
481,2014-04-27 00:00:00,2014-04-27,1^ALEX,818.0,04-27,2014,4,Alexandra Bridge
482,2014-04-28 00:00:00,2014-04-28,1^ALEX,1420.0,04-28,2014,4,Alexandra Bridge
483,2014-04-29 00:00:00,2014-04-29,1^ALEX,1057.0,04-29,2014,4,Alexandra Bridge
484,2014-04-30 00:00:00,2014-04-30,1^ALEX,565.0,04-30,2014,4,Alexandra Bridge
485,2014-05-01 00:00:00,2014-05-01,1^ALEX,780.0,05-01,2014,5,Alexandra Bridge
486,2014-05-02 00:00:00,2014-05-02,1^ALEX,1201.0,05-02,2014,5,Alexandra Bridge
487,2014-05-03 00:00:00,2014-05-03,1^ALEX,566.0,05-03,2014,5,Alexandra Bridge
488,2014-05-04 00:00:00,2014-05-04,1^ALEX,237.0,05-04,2014,5,Alexandra Bridge
489,2014-05-05 00:00:00,2014-05-05,1^ALEX,1704.0,05-05,2014,5,Alexandra Bridge
490,2014-05-06 00:00:00,2014-05-06,1^ALEX,1868.0,05-06,2014,5,Alexandra Bridge
491,2014-05-07 00:00:00,2014-05-07,1^ALEX,2085.0,05-07,2014,5,Alexandra Bridge
492,2014-05-08 00:00:00,2014-05-08,1^ALEX,2232.0,05-08,2014,5,Alexandra Bridge
493,2014-05-09 00:00:00,2014-05-09,1^ALEX,1217.0,05-09,2014,5,Alexandra Bridge
494,2014-05-10 00:00:00,2014-05-10,1^ALEX,1325.0,05-10,2014,5,Alexandra Bridge
495,2014-05-11 00:00:00,2014-05-11,1^ALEX,1600.0,05-11,2014,5,Alexandra Bridge
496,2014-05-12 00:00:00,2014-05-12,1^ALEX,2062.0,05-12,2014,5,Alexandra Bridge
497,2014-05-13 00:00:00,2014-05-13,1^ALEX,1430.0,05-13,2014,5,Alexandra Bridge
498,2014-05-14 00:00:00,2014-05-14,1^ALEX,2144.0,05-14,2014,5,Alexandra Bridge
499,2014-05-15 00:00:00,2014-05-15,1^ALEX,1915.0,05-15,2014,5,Alexandra Bridge
500,2014-05-16 00:00:00,2014-05-16,1^ALEX,846.0,05-16,2014,5,Alexandra Bridge
501,2014-05-17 00:00:00,2014-05-17,1^ALEX,1275.0,05-17,2014,5,Alexandra Bridge
502,2014-05-18 00:00:00,2014-05-18,1^ALEX,1979.0,05-18,2014,5,Alexandra Bridge
503,2014-05-19 00:00:00,2014-05-19,1^ALEX,2196.0,05-19,2014,5,Alexandra Bridge
504,2014-05-20 00:00:00,2014-05-20,1^ALEX,1943.0,05-20,2014,5,Alexandra Bridge
505,2014-05-21 00:00:00,2014-05-21,1^ALEX,2599.0,05-21,2014,5,Alexandra Bridge
506,2014-05-22 00:00:00,2014-05-22,1^ALEX,1906.0,05-22,2014,5,Alexandra Bridge
507,2014-05-23 00:00:00,2014-05-23,1^ALEX,1690.0,05-23,2014,5,Alexandra Bridge
508,2014-05-24 00:00:00,2014-05-24,1^ALEX,1469.0,05-24,2014,5,Alexandra Bridge
509,2014-05-25 00:00:00,2014-05-25,1^ALEX,1809.0,05-25,2014,5,Alexandra Bridge
510,2014-05-26 00:00:00,2014-05-26,1^ALEX,1913.0,05-26,2014,5,Alexandra Bridge
511,2014-05-27 00:00:00,2014-05-27,1^ALEX,2095.0,05-27,2014,5,Alexandra Bridge
512,2014-05-28 00:00:00,2014-05-28,1^ALEX,1958.0,05-28,2014,5,Alexandra Bridge
513,2014-05-29 00:00:00,2014-05-29,1^ALEX,2297.0,05-29,2014,5,Alexandra Bridge
514,2014-05-30 00:00:00,2014-05-30,1^ALEX,2202.0,05-30,2014,5,Alexandra Bridge
515,2014-05-31 00:00:00,2014-05-31,1^ALEX,2190.0,05-31,2014,5,Alexandra Bridge
516,2014-06-01 00:00:00,2014-06-01,1^ALEX,2100.0,06-01,2014,6,Alexandra Bridge
517,2014-06-02 00:00:00,2014-06-02,1^ALEX,2485.0,06-02,2014,6,Alexandra Bridge
518,2014-06-03 00:00:00,2014-06-03,1^ALEX,1483.0,06-03,2014,6,Alexandra Bridge
519,2014-06-04 00:00:00,2014-06-04,1^ALEX,2535.0,06-04,2014,6,Alexandra Bridge
520,2014-06-05 00:00:00,2014-06-05,1^ALEX,1934.0,06-05,2014,6,Alexandra Bridge
521,2014-06-06 00:00:00,2014-06-06,1^ALEX,2184.0,06-06,2014,6,Alexandra Bridge
522,2014-06-07 00:00:00,2014-06-07,1^ALEX,1806.0,06-07,2014,6,Alexandra Bridge
523,2014-06-08 00:00:00,2014-06-08,1^ALEX,2048.0,06-08,2014,6,Alexandra Bridge
524,2014-06-09 00:00:00,2014-06-09,1^ALEX,2553.0,06-09,2014,6,Alexandra Bridge
525,2014-06-10 00:00:00,2014-06-10,1^ALEX,2895.0,06-10,2014,6,Alexandra Bridge
526,2014-06-11 00:00:00,2014-06-11,1^ALEX,1564.0,06-11,2014,6,Alexandra Bridge
527,2014-06-12 00:00:00,2014-06-12,1^ALEX,937.0,06-12,2014,6,Alexandra Bridge
528,2014-06-13 00:00:00,2014-06-13,1^ALEX,883.0,06-13,2014,6,Alexandra Bridge
529,2014-06-14 00:00:00,2014-06-14,1^ALEX,1084.0,06-14,2014,6,Alexandra Bridge
530,2014-06-15 00:00:00,2014-06-15,1^ALEX,2170.0,06-15,2014,6,Alexandra Bridge
531,2014-06-16 00:00:00,2014-06-16,1^ALEX,2285.0,06-16,2014,6,Alexandra Bridge
532,2014-06-17 00:00:00,2014-06-17,1^ALEX,2353.0,06-17,2014,6,Alexandra Bridge
533,2014-06-18 00:00:00,2014-06-18,1^ALEX,2301.0,06-18,2014,6,Alexandra Bridge
534,2014-06-19 00:00:00,2014-06-19,1^ALEX,2770.0,06-19,2014,6,Alexandra Bridge
535,2014-06-20 00:00:00,2014-06-20,1^ALEX,2224.0,06-20,2014,6,Alexandra Bridge
536,2014-06-21 00:00:00,2014-06-21,1^ALEX,1641.0,06-21,2014,6,Alexandra Bridge
537,2014-06-22 00:00:00,2014-06-22,1^ALEX,2167.0,06-22,2014,6,Alexandra Bridge
538,2014-06-23 00:00:00,2014-06-23,1^ALEX,2419.0,06-23,2014,6,Alexandra Bridge
539,2014-06-24 00:00:00,2014-06-24,1^ALEX,627.0,06-24,2014,6,Alexandra Bridge
540,2014-06-25 00:00:00,2014-06-25,1^ALEX,2089.0,06-25,2014,6,Alexandra Bridge
541,2014-06-26 00:00:00,2014-06-26,1^ALEX,2610.0,06-26,2014,6,Alexandra Bridge
542,2014-06-27 00:00:00,2014-06-27,1^ALEX,2410.0,06-27,2014,6,Alexandra Bridge
543,2014-06-28 00:00:00,2014-06-28,1^ALEX,1846.0,06-28,2014,6,Alexandra Bridge
544,2014-06-29 00:00:00,2014-06-29,1^ALEX,1862.0,06-29,2014,6,Alexandra Bridge
545,2014-06-30 00:00:00,2014-06-30,1^ALEX,1988.0,06-30,2014,6,Alexandra Bridge
546,2014-07-01 00:00:00,2014-07-01,1^ALEX,764.0,07-01,2014,7,Alexandra Bridge
547,2014-07-02 00:00:00,2014-07-02,1^ALEX,2198.0,07-02,2014,7,Alexandra Bridge
548,2014-07-03 00:00:00,2014-07-03,1^ALEX,2073.0,07-03,2014,7,Alexandra Bridge
549,2014-07-04 00:00:00,2014-07-04,1^ALEX,2066.0,07-04,2014,7,Alexandra Bridge
550,2014-07-05 00:00:00,2014-07-05,1^ALEX,1784.0,07-05,2014,7,Alexandra Bridge
551,2014-07-06 00:00:00,2014-07-06,1^ALEX,1986.0,07-06,2014,7,Alexandra Bridge
552,2014-07-07 00:00:00,2014-07-07,1^ALEX,1130.0,07-07,2014,7,Alexandra Bridge
553,2014-07-08 00:00:00,2014-07-08,1^ALEX,2183.0,07-08,2014,7,Alexandra Bridge
554,2014-07-09 00:00:00,2014-07-09,1^ALEX,2081.0,07-09,2014,7,Alexandra Bridge
555,2014-07-10 00:00:00,2014-07-10,1^ALEX,2677.0,07-10,2014,7,Alexandra Bridge
556,2014-07-11 00:00:00,2014-07-11,1^ALEX,2364.0,07-11,2014,7,Alexandra Bridge
557,2014-07-12 00:00:00,2014-07-12,1^ALEX,1770.0,07-12,2014,7,Alexandra Bridge
558,2014-07-13 00:00:00,2014-07-13,1^ALEX,465.0,07-13,2014,7,Alexandra Bridge
559,2014-07-14 00:00:00,2014-07-14,1^ALEX,2504.0,07-14,2014,7,Alexandra Bridge
560,2014-07-15 00:00:00,2014-07-15,1^ALEX,1508.0,07-15,2014,7,Alexandra Bridge
561,2014-07-16 00:00:00,2014-07-16,1^ALEX,2480.0,07-16,2014,7,Alexandra Bridge
562,2014-07-17 00:00:00,2014-07-17,1^ALEX,2531.0,07-17,2014,7,Alexandra Bridge
563,2014-07-18 00:00:00,2014-07-18,1^ALEX,2305.0,07-18,2014,7,Alexandra Bridge
564,2014-07-19 00:00:00,2014-07-19,1^ALEX,1689.0,07-19,2014,7,Alexandra Bridge
565,2014-07-20 00:00:00,2014-07-20,1^ALEX,1597.0,07-20,2014,7,Alexandra Bridge
566,2014-07-21 00:00:00,2014-07-21,1^ALEX,2425.0,07-21,2014,7,Alexandra Bridge
567,2014-07-22 00:00:00,2014-07-22,1^ALEX,2688.0,07-22,2014,7,Alexandra Bridge
568,2014-07-23 00:00:00,2014-07-23,1^ALEX,2115.0,07-23,2014,7,Alexandra Bridge
569,2014-07-24 00:00:00,2014-07-24,1^ALEX,2838.0,07-24,2014,7,Alexandra Bridge
570,2014-07-25 00:00:00,2014-07-25,1^ALEX,2373.0,07-25,2014,7,Alexandra Bridge
571,2014-07-26 00:00:00,2014-07-26,1^ALEX,1416.0,07-26,2014,7,Alexandra Bridge
572,2014-07-27 00:00:00,2014-07-27,1^ALEX,1046.0,07-27,2014,7,Alexandra Bridge
573,2014-07-28 00:00:00,2014-07-28,1^ALEX,1487.0,07-28,2014,7,Alexandra Bridge
574,2014-07-29 00:00:00,2014-07-29,1^ALEX,2685.0,07-29,2014,7,Alexandra Bridge
575,2014-07-30 00:00:00,2014-07-30,1^ALEX,1072.0,07-30,2014,7,Alexandra Bridge
576,2014-07-31 00:00:00,2014-07-31,1^ALEX,1664.0,07-31,2014,7,Alexandra Bridge
577,2014-08-01 00:00:00,2014-08-01,1^ALEX,2179.0,08-01,2014,8,Alexandra Bridge
578,2014-08-02 00:00:00,2014-08-02,1^ALEX,1743.0,08-02,2014,8,Alexandra Bridge
579,2014-08-03 00:00:00,2014-08-03,1^ALEX,2319.0,08-03,2014,8,Alexandra Bridge
580,2014-08-04 00:00:00,2014-08-04,1^ALEX,1900.0,08-04,2014,8,Alexandra Bridge
581,2014-08-05 00:00:00,2014-08-05,1^ALEX,2142.0,08-05,2014,8,Alexandra Bridge
582,2014-08-06 00:00:00,2014-08-06,1^ALEX,2543.0,08-06,2014,8,Alexandra Bridge
583,2014-08-07 00:00:00,2014-08-07,1^ALEX,2570.0,08-07,2014,8,Alexandra Bridge
584,2014-08-08 00:00:00,2014-08-08,1^ALEX,2188.0,08-08,2014,8,Alexandra Bridge
585,2014-08-09 00:00:00,2014-08-09,1^ALEX,1707.0,08-09,2014,8,Alexandra Bridge
586,2014-08-10 00:00:00,2014-08-10,1^ALEX,2049.0,08-10,2014,8,Alexandra Bridge
587,2014-08-11 00:00:00,2014-08-11,1^ALEX,2385.0,08-11,2014,8,Alexandra Bridge
588,2014-08-12 00:00:00,2014-08-12,1^ALEX,1188.0,08-12,2014,8,Alexandra Bridge
589,2014-08-13 00:00:00,2014-08-13,1^ALEX,989.0,08-13,2014,8,Alexandra Bridge
590,2014-08-14 00:00:00,2014-08-14,1^ALEX,1227.0,08-14,2014,8,Alexandra Bridge
591,2014-08-15 00:00:00,2014-08-15,1^ALEX,1203.0,08-15,2014,8,Alexandra Bridge
592,2014-08-16 00:00:00,2014-08-16,1^ALEX,509.0,08-16,2014,8,Alexandra Bridge
593,2014-08-17 00:00:00,2014-08-17,1^ALEX,1392.0,08-17,2014,8,Alexandra Bridge
594,2014-08-18 00:00:00,2014-08-18,1^ALEX,2187.0,08-18,2014,8,Alexandra Bridge
595,2014-08-19 00:00:00,2014-08-19,1^ALEX,2436.0,08-19,2014,8,Alexandra Bridge
596,2014-08-20 00:00:00,2014-08-20,1^ALEX,2256.0,08-20,2014,8,Alexandra Bridge
597,2014-08-21 00:00:00,2014-08-21,1^ALEX,1172.0,08-21,2014,8,Alexandra Bridge
598,2014-08-22 00:00:00,2014-08-22,1^ALEX,1815.0,08-22,2014,8,Alexandra Bridge
599,2014-08-23 00:00:00,2014-08-23,1^ALEX,1738.0,08-23,2014,8,Alexandra Bridge
600,2014-08-24 00:00:00,2014-08-24,1^ALEX,1837.0,08-24,2014,8,Alexandra Bridge
601,2014-08-25 00:00:00,2014-08-25,1^ALEX,2403.0,08-25,2014,8,Alexandra Bridge
602,2014-08-26 00:00:00,2014-08-26,1^ALEX,2266.0,08-26,2014,8,Alexandra Bridge
603,2014-08-27 00:00:00,2014-08-27,1^ALEX,2384.0,08-27,2014,8,Alexandra Bridge
604,2014-08-28 00:00:00,2014-08-28,1^ALEX,2064.0,08-28,2014,8,Alexandra Bridge
605,2014-08-29 00:00:00,2014-08-29,1^ALEX,2111.0,08-29,2014,8,Alexandra Bridge
606,2014-08-30 00:00:00,2014-08-30,1^ALEX,1607.0,08-30,2014,8,Alexandra Bridge
607,2014-08-31 00:00:00,2014-08-31,1^ALEX,986.0,08-31,2014,8,Alexandra Bridge
608,2014-09-01 00:00:00,2014-09-01,1^ALEX,2114.0,09-01,2014,9,Alexandra Bridge
609,2014-09-02 00:00:00,2014-09-02,1^ALEX,1612.0,09-02,2014,9,Alexandra Bridge
610,2014-09-03 00:00:00,2014-09-03,1^ALEX,2669.0,09-03,2014,9,Alexandra Bridge
611,2014-09-04 00:00:00,2014-09-04,1^ALEX,2515.0,09-04,2014,9,Alexandra Bridge
612,2014-09-05 00:00:00,2014-09-05,1^ALEX,1913.0,09-05,2014,9,Alexandra Bridge
613,2014-09-06 00:00:00,2014-09-06,1^ALEX,882.0,09-06,2014,9,Alexandra Bridge
614,2014-09-07 00:00:00,2014-09-07,1^ALEX,1900.0,09-07,2014,9,Alexandra Bridge
615,2014-09-08 00:00:00,2014-09-08,1^ALEX,2593.0,09-08,2014,9,Alexandra Bridge
616,2014-09-09 00:00:00,2014-09-09,1^ALEX,2624.0,09-09,2014,9,Alexandra Bridge
617,2014-09-10 00:00:00,2014-09-10,1^ALEX,2351.0,09-10,2014,9,Alexandra Bridge
618,2014-09-11 00:00:00,2014-09-11,1^ALEX,1470.0,09-11,2014,9,Alexandra Bridge
619,2014-09-12 00:00:00,2014-09-12,1^ALEX,1995.0,09-12,2014,9,Alexandra Bridge
620,2014-09-13 00:00:00,2014-09-13,1^ALEX,370.0,09-13,2014,9,Alexandra Bridge
621,2014-09-14 00:00:00,2014-09-14,1^ALEX,827.0,09-14,2014,9,Alexandra Bridge
622,2014-09-15 00:00:00,2014-09-15,1^ALEX,1949.0,09-15,2014,9,Alexandra Bridge
623,2014-09-16 00:00:00,2014-09-16,1^ALEX,2300.0,09-16,2014,9,Alexandra Bridge
624,2014-09-17 00:00:00,2014-09-17,1^ALEX,1784.0,09-17,2014,9,Alexandra Bridge
625,2014-09-18 00:00:00,2014-09-18,1^ALEX,1964.0,09-18,2014,9,Alexandra Bridge
626,2014-09-19 00:00:00,2014-09-19,1^ALEX,1732.0,09-19,2014,9,Alexandra Bridge
627,2014-09-20 00:00:00,2014-09-20,1^ALEX,779.0,09-20,2014,9,Alexandra Bridge
628,2014-09-21 00:00:00,2014-09-21,1^ALEX,470.0,09-21,2014,9,Alexandra Bridge
629,2014-09-22 00:00:00,2014-09-22,1^ALEX,1489.0,09-22,2014,9,Alexandra Bridge
630,2014-09-23 00:00:00,2014-09-23,1^ALEX,1802.0,09-23,2014,9,Alexandra Bridge
631,2014-09-24 00:00:00,2014-09-24,1^ALEX,2050.0,09-24,2014,9,Alexandra Bridge
632,2014-09-25 00:00:00,2014-09-25,1^ALEX,2256.0,09-25,2014,9,Alexandra Bridge
633,2014-09-26 00:00:00,2014-09-26,1^ALEX,2201.0,09-26,2014,9,Alexandra Bridge
634,2014-09-27 00:00:00,2014-09-27,1^ALEX,1681.0,09-27,2014,9,Alexandra Bridge
635,2014-09-28 00:00:00,2014-09-28,1^ALEX,1729.0,09-28,2014,9,Alexandra Bridge
636,2014-09-29 00:00:00,2014-09-29,1^ALEX,2017.0,09-29,2014,9,Alexandra Bridge
637,2014-09-30 00:00:00,2014-09-30,1^ALEX,1906.0,09-30,2014,9,Alexandra Bridge
638,2014-10-01 00:00:00,2014-10-01,1^ALEX,1965.0,10-01,2014,10,Alexandra Bridge
639,2014-10-02 00:00:00,2014-10-02,1^ALEX,2085.0,10-02,2014,10,Alexandra Bridge
640,2014-10-03 00:00:00,2014-10-03,1^ALEX,1869.0,10-03,2014,10,Alexandra Bridge
641,2014-10-04 00:00:00,2014-10-04,1^ALEX,296.0,10-04,2014,10,Alexandra Bridge
642,2014-10-05 00:00:00,2014-10-05,1^ALEX,709.0,10-05,2014,10,Alexandra Bridge
643,2014-10-06 00:00:00,2014-10-06,1^ALEX,1450.0,10-06,2014,10,Alexandra Bridge
644,2014-10-07 00:00:00,2014-10-07,1^ALEX,1069.0,10-07,2014,10,Alexandra Bridge
645,2014-10-08 00:00:00,2014-10-08,1^ALEX,1096.0,10-08,2014,10,Alexandra Bridge
646,2014-10-09 00:00:00,2014-10-09,1^ALEX,1355.0,10-09,2014,10,Alexandra Bridge
647,2014-10-10 00:00:00,2014-10-10,1^ALEX,1387.0,10-10,2014,10,Alexandra Bridge
648,2014-10-11 00:00:00,2014-10-11,1^ALEX,678.0,10-11,2014,10,Alexandra Bridge
649,2014-10-12 00:00:00,2014-10-12,1^ALEX,928.0,10-12,2014,10,Alexandra Bridge
650,2014-10-13 00:00:00,2014-10-13,1^ALEX,883.0,10-13,2014,10,Alexandra Bridge
651,2014-10-14 00:00:00,2014-10-14,1^ALEX,1815.0,10-14,2014,10,Alexandra Bridge
652,2014-10-15 00:00:00,2014-10-15,1^ALEX,861.0,10-15,2014,10,Alexandra Bridge
653,2014-10-16 00:00:00,2014-10-16,1^ALEX,842.0,10-16,2014,10,Alexandra Bridge
654,2014-10-17 00:00:00,2014-10-17,1^ALEX,1065.0,10-17,2014,10,Alexandra Bridge
655,2014-10-18 00:00:00,2014-10-18,1^ALEX,388.0,10-18,2014,10,Alexandra Bridge
656,2014-10-19 00:00:00,2014-10-19,1^ALEX,522.0,10-19,2014,10,Alexandra Bridge
657,2014-10-20 00:00:00,2014-10-20,1^ALEX,1189.0,10-20,2014,10,Alexandra Bridge
658,2014-10-21 00:00:00,2014-10-21,1^ALEX,832.0,10-21,2014,10,Alexandra Bridge
659,2014-10-22 00:00:00,2014-10-22,1^ALEX,1140.0,10-22,2014,10,Alexandra Bridge
660,2014-10-23 00:00:00,2014-10-23,1^ALEX,1443.0,10-23,2014,10,Alexandra Bridge
661,2014-10-24 00:00:00,2014-10-24,1^ALEX,1563.0,10-24,2014,10,Alexandra Bridge
662,2014-10-25 00:00:00,2014-10-25,1^ALEX,396.0,10-25,2014,10,Alexandra Bridge
663,2014-10-26 00:00:00,2014-10-26,1^ALEX,450.0,10-26,2014,10,Alexandra Bridge
664,2014-10-27 00:00:00,2014-10-27,1^ALEX,1459.0,10-27,2014,10,Alexandra Bridge
665,2014-10-28 00:00:00,2014-10-28,1^ALEX,1027.0,10-28,2014,10,Alexandra Bridge
666,2014-10-29 00:00:00,2014-10-29,1^ALEX,1376.0,10-29,2014,10,Alexandra Bridge
667,2014-10-30 00:00:00,2014-10-30,1^ALEX,1413.0,10-30,2014,10,Alexandra Bridge
668,2014-10-31 00:00:00,2014-10-31,1^ALEX,1071.0,10-31,2014,10,Alexandra Bridge
669,2014-11-01 00:00:00,2014-11-01,1^ALEX,334.0,11-01,2014,11,Alexandra Bridge
670,2014-11-02 00:00:00,2014-11-02,1^ALEX,461.0,11-02,2014,11,Alexandra Bridge
671,2014-11-03 00:00:00,2014-11-03,1^ALEX,724.0,11-03,2014,11,Alexandra Bridge
672,2014-11-04 00:00:00,2014-11-04,1^ALEX,1083.0,11-04,2014,11,Alexandra Bridge
673,2014-11-05 00:00:00,2014-11-05,1^ALEX,1166.0,11-05,2014,11,Alexandra Bridge
674,2014-11-06 00:00:00,2014-11-06,1^ALEX,1067.0,11-06,2014,11,Alexandra Bridge
675,2014-11-07 00:00:00,2014-11-07,1^ALEX,783.0,11-07,2014,11,Alexandra Bridge
676,2014-11-08 00:00:00,2014-11-08,1^ALEX,304.0,11-08,2014,11,Alexandra Bridge
677,2014-11-09 00:00:00,2014-11-09,1^ALEX,277.0,11-09,2014,11,Alexandra Bridge
678,2014-11-10 00:00:00,2014-11-10,1^ALEX,861.0,11-10,2014,11,Alexandra Bridge
679,2014-11-11 00:00:00,2014-11-11,1^ALEX,823.0,11-11,2014,11,Alexandra Bridge
680,2014-11-12 00:00:00,2014-11-12,1^ALEX,879.0,11-12,2014,11,Alexandra Bridge
681,2014-11-13 00:00:00,2014-11-13,1^ALEX,969.0,11-13,2014,11,Alexandra Bridge
682,2014-11-14 00:00:00,2014-11-14,1^ALEX,809.0,11-14,2014,11,Alexandra Bridge
683,2014-11-15 00:00:00,2014-11-15,1^ALEX,253.0,11-15,2014,11,Alexandra Bridge
684,2014-11-16 00:00:00,2014-11-16,1^ALEX,137.0,11-16,2014,11,Alexandra Bridge
685,2014-11-17 00:00:00,2014-11-17,1^ALEX,296.0,11-17,2014,11,Alexandra Bridge
686,2014-11-18 00:00:00,2014-11-18,1^ALEX,29.0,11-18,2014,11,Alexandra Bridge
687,2014-11-19 00:00:00,2014-11-19,1^ALEX,23.0,11-19,2014,11,Alexandra Bridge
688,2014-11-20 00:00:00,2014-11-20,1^ALEX,27.0,11-20,2014,11,Alexandra Bridge
689,2014-11-21 00:00:00,2014-11-21,1^ALEX,38.0,11-21,2014,11,Alexandra Bridge
690,2014-11-22 00:00:00,2014-11-22,1^ALEX,40.0,11-22,2014,11,Alexandra Bridge
691,2014-11-23 00:00:00,2014-11-23,1^ALEX,147.0,11-23,2014,11,Alexandra Bridge
692,2014-11-24 00:00:00,2014-11-24,1^ALEX,440.0,11-24,2014,11,Alexandra Bridge
693,2014-11-25 00:00:00,2014-11-25,1^ALEX,620.0,11-25,2014,11,Alexandra Bridge
694,2014-11-26 00:00:00,2014-11-26,1^ALEX,640.0,11-26,2014,11,Alexandra Bridge
695,2014-11-27 00:00:00,2014-11-27,1^ALEX,666.0,11-27,2014,11,Alexandra Bridge
696,2014-11-28 00:00:00,2014-11-28,1^ALEX,475.0,11-28,2014,11,Alexandra Bridge
697,2014-11-29 00:00:00,2014-11-29,1^ALEX,159.0,11-29,2014,11,Alexandra Bridge
698,2014-11-30 00:00:00,2014-11-30,1^ALEX,176.0,11-30,2014,11,Alexandra Bridge
699,2014-12-01 00:00:00,2014-12-01,1^ALEX,569.0,12-01,2014,12,Alexandra Bridge
700,2014-12-02 00:00:00,2014-12-02,1^ALEX,394.0,12-02,2014,12,Alexandra Bridge
701,2014-12-03 00:00:00,2014-12-03,1^ALEX,85.0,12-03,2014,12,Alexandra Bridge
702,2014-12-04 00:00:00,2014-12-04,1^ALEX,90.0,12-04,2014,12,Alexandra Bridge
703,2014-12-05 00:00:00,2014-12-05,1^ALEX,43.0,12-05,2014,12,Alexandra Bridge
704,2014-12-06 00:00:00,2014-12-06,1^ALEX,28.0,12-06,2014,12,Alexandra Bridge
705,2014-12-07 00:00:00,2014-12-07,1^ALEX,25.0,12-07,2014,12,Alexandra Bridge
706,2014-12-08 00:00:00,2014-12-08,1^ALEX,44.0,12-08,2014,12,Alexandra Bridge
707,2014-12-09 00:00:00,2014-12-09,1^ALEX,58.0,12-09,2014,12,Alexandra Bridge
708,2014-12-10 00:00:00,2014-12-10,1^ALEX,28.0,12-10,2014,12,Alexandra Bridge
709,2014-12-11 00:00:00,2014-12-11,1^ALEX,1.0,12-11,2014,12,Alexandra Bridge
710,2014-12-12 00:00:00,2014-12-12,1^ALEX,6.0,12-12,2014,12,Alexandra Bridge
711,2014-12-13 00:00:00,2014-12-13,1^ALEX,8.0,12-13,2014,12,Alexandra Bridge
712,2014-12-14 00:00:00,2014-12-14,1^ALEX,15.0,12-14,2014,12,Alexandra Bridge
713,2014-12-15 00:00:00,2014-12-15,1^ALEX,35.0,12-15,2014,12,Alexandra Bridge
714,2014-12-16 00:00:00,2014-12-16,1^ALEX,37.0,12-16,2014,12,Alexandra Bridge
715,2014-12-17 00:00:00,2014-12-17,1^ALEX,16.0,12-17,2014,12,Alexandra Bridge
716,2014-12-18 00:00:00,2014-12-18,1^ALEX,4.0,12-18,2014,12,Alexandra Bridge
717,2014-12-19 00:00:00,2014-12-19,1^ALEX,5.0,12-19,2014,12,Alexandra Bridge
718,2014-12-20 00:00:00,2014-12-20,1^ALEX,5.0,12-20,2014,12,Alexandra Bridge
719,2014-12-21 00:00:00,2014-12-21,1^ALEX,4.0,12-21,2014,12,Alexandra Bridge
720,2014-12-22 00:00:00,2014-12-22,1^ALEX,5.0,12-22,2014,12,Alexandra Bridge
721,2014-12-23 00:00:00,2014-12-23,1^ALEX,19.0,12-23,2014,12,Alexandra Bridge
722,2014-12-24 00:00:00,2014-12-24,1^ALEX,23.0,12-24,2014,12,Alexandra Bridge
723,2014-12-25 00:00:00,2014-12-25,1^ALEX,35.0,12-25,2014,12,Alexandra Bridge
724,2014-12-26 00:00:00,2014-12-26,1^ALEX,27.0,12-26,2014,12,Alexandra Bridge
725,2014-12-27 00:00:00,2014-12-27,1^ALEX,0.0,12-27,2014,12,Alexandra Bridge
726,2014-12-28 00:00:00,2014-12-28,1^ALEX,0.0,12-28,2014,12,Alexandra Bridge
727,2014-12-29 00:00:00,2014-12-29,1^ALEX,0.0,12-29,2014,12,Alexandra Bridge
728,2014-12-30 00:00:00,2014-12-30,1^ALEX,0.0,12-30,2014,12,Alexandra Bridge
729,2014-12-31 00:00:00,2014-12-31,1^ALEX,0.0,12-31,2014,12,Alexandra Bridge
730,2015-01-01 00:00:00,2015-01-01,1^ALEX,66.0,01-01,2015,1,Alexandra Bridge
731,2015-01-02 00:00:00,2015-01-02,1^ALEX,69.0,01-02,2015,1,Alexandra Bridge
732,2015-01-03 00:00:00,2015-01-03,1^ALEX,24.0,01-03,2015,1,Alexandra Bridge
733,2015-01-04 00:00:00,2015-01-04,1^ALEX,4.0,01-04,2015,1,Alexandra Bridge
734,2015-01-05 00:00:00,2015-01-05,1^ALEX,10.0,01-05,2015,1,Alexandra Bridge
735,2015-01-06 00:00:00,2015-01-06,1^ALEX,4.0,01-06,2015,1,Alexandra Bridge
736,2015-01-07 00:00:00,2015-01-07,1^ALEX,2.0,01-07,2015,1,Alexandra Bridge
737,2015-01-08 00:00:00,2015-01-08,1^ALEX,2.0,01-08,2015,1,Alexandra Bridge
738,2015-01-09 00:00:00,2015-01-09,1^ALEX,1.0,01-09,2015,1,Alexandra Bridge
739,2015-01-10 00:00:00,2015-01-10,1^ALEX,1.0,01-10,2015,1,Alexandra Bridge
740,2015-01-11 00:00:00,2015-01-11,1^ALEX,1.0,01-11,2015,1,Alexandra Bridge
741,2015-01-12 00:00:00,2015-01-12,1^ALEX,1.0,01-12,2015,1,Alexandra Bridge
742,2015-01-13 00:00:00,2015-01-13,1^ALEX,0.0,01-13,2015,1,Alexandra Bridge
743,2015-01-14 00:00:00,2015-01-14,1^ALEX,1.0,01-14,2015,1,Alexandra Bridge
744,2015-01-15 00:00:00,2015-01-15,1^ALEX,2.0,01-15,2015,1,Alexandra Bridge
745,2015-01-16 00:00:00,2015-01-16,1^ALEX,4.0,01-16,2015,1,Alexandra Bridge
746,2015-01-17 00:00:00,2015-01-17,1^ALEX,1.0,01-17,2015,1,Alexandra Bridge
747,2015-01-18 00:00:00,2015-01-18,1^ALEX,4.0,01-18,2015,1,Alexandra Bridge
748,2015-01-19 00:00:00,2015-01-19,1^ALEX,3.0,01-19,2015,1,Alexandra Bridge
749,2015-01-20 00:00:00,2015-01-20,1^ALEX,1.0,01-20,2015,1,Alexandra Bridge
750,2015-01-21 00:00:00,2015-01-21,1^ALEX,0.0,01-21,2015,1,Alexandra Bridge
751,2015-01-22 00:00:00,2015-01-22,1^ALEX,0.0,01-22,2015,1,Alexandra Bridge
752,2015-01-23 00:00:00,2015-01-23,1^ALEX,6.0,01-23,2015,1,Alexandra Bridge
753,2015-01-24 00:00:00,2015-01-24,1^ALEX,4.0,01-24,2015,1,Alexandra Bridge
754,2015-01-25 00:00:00,2015-01-25,1^ALEX,2.0,01-25,2015,1,Alexandra Bridge
755,2015-01-26 00:00:00,2015-01-26,1^ALEX,4.0,01-26,2015,1,Alexandra Bridge
756,2015-01-27 00:00:00,2015-01-27,1^ALEX,13.0,01-27,2015,1,Alexandra Bridge
757,2015-01-28 00:00:00,2015-01-28,1^ALEX,9.0,01-28,2015,1,Alexandra Bridge
758,2015-01-29 00:00:00,2015-01-29,1^ALEX,6.0,01-29,2015,1,Alexandra Bridge
759,2015-01-30 00:00:00,2015-01-30,1^ALEX,1.0,01-30,2015,1,Alexandra Bridge
760,2015-01-31 00:00:00,2015-01-31,1^ALEX,0.0,01-31,2015,1,Alexandra Bridge
761,2015-02-01 00:00:00,2015-02-01,1^ALEX,0.0,02-01,2015,2,Alexandra Bridge
762,2015-02-02 00:00:00,2015-02-02,1^ALEX,1.0,02-02,2015,2,Alexandra Bridge
763,2015-02-03 00:00:00,2015-02-03,1^ALEX,0.0,02-03,2015,2,Alexandra Bridge
764,2015-02-04 00:00:00,2015-02-04,1^ALEX,0.0,02-04,2015,2,Alexandra Bridge
765,2015-02-05 00:00:00,2015-02-05,1^ALEX,0.0,02-05,2015,2,Alexandra Bridge
766,2015-02-06 00:00:00,2015-02-06,1^ALEX,0.0,02-06,2015,2,Alexandra Bridge
767,2015-02-07 00:00:00,2015-02-07,1^ALEX,0.0,02-07,2015,2,Alexandra Bridge
768,2015-02-08 00:00:00,2015-02-08,1^ALEX,0.0,02-08,2015,2,Alexandra Bridge
769,2015-02-09 00:00:00,2015-02-09,1^ALEX,0.0,02-09,2015,2,Alexandra Bridge
770,2015-02-10 00:00:00,2015-02-10,1^ALEX,0.0,02-10,2015,2,Alexandra Bridge
771,2015-02-11 00:00:00,2015-02-11,1^ALEX,0.0,02-11,2015,2,Alexandra Bridge
772,2015-02-12 00:00:00,2015-02-12,1^ALEX,0.0,02-12,2015,2,Alexandra Bridge
773,2015-02-13 00:00:00,2015-02-13,1^ALEX,0.0,02-13,2015,2,Alexandra Bridge
774,2015-02-14 00:00:00,2015-02-14,1^ALEX,0.0,02-14,2015,2,Alexandra Bridge
775,2015-02-15 00:00:00,2015-02-15,1^ALEX,3.0,02-15,2015,2,Alexandra Bridge
776,2015-02-16 00:00:00,2015-02-16,1^ALEX,0.0,02-16,2015,2,Alexandra Bridge
777,2015-02-17 00:00:00,2015-02-17,1^ALEX,0.0,02-17,2015,2,Alexandra Bridge
778,2015-02-18 00:00:00,2015-02-18,1^ALEX,0.0,02-18,2015,2,Alexandra Bridge
779,2015-02-19 00:00:00,2015-02-19,1^ALEX,1.0,02-19,2015,2,Alexandra Bridge
780,2015-02-20 00:00:00,2015-02-20,1^ALEX,1.0,02-20,2015,2,Alexandra Bridge
781,2015-02-21 00:00:00,2015-02-21,1^ALEX,0.0,02-21,2015,2,Alexandra Bridge
782,2015-02-22 00:00:00,2015-02-22,1^ALEX,0.0,02-22,2015,2,Alexandra Bridge
783,2015-02-23 00:00:00,2015-02-23,1^ALEX,0.0,02-23,2015,2,Alexandra Bridge
784,2015-02-24 00:00:00,2015-02-24,1^ALEX,7.0,02-24,2015,2,Alexandra Bridge
785,2015-02-25 00:00:00,2015-02-25,1^ALEX,6.0,02-25,2015,2,Alexandra Bridge
786,2015-02-26 00:00:00,2015-02-26,1^ALEX,11.0,02-26,2015,2,Alexandra Bridge
787,2015-02-27 00:00:00,2015-02-27,1^ALEX,4.0,02-27,2015,2,Alexandra Bridge
788,2015-02-28 00:00:00,2015-02-28,1^ALEX,8.0,02-28,2015,2,Alexandra Bridge
789,2015-03-01 00:00:00,2015-03-01,1^ALEX,2.0,03-01,2015,3,Alexandra Bridge
790,2015-03-02 00:00:00,2015-03-02,1^ALEX,24.0,03-02,2015,3,Alexandra Bridge
791,2015-03-03 00:00:00,2015-03-03,1^ALEX,15.0,03-03,2015,3,Alexandra Bridge
792,2015-03-04 00:00:00,2015-03-04,1^ALEX,6.0,03-04,2015,3,Alexandra Bridge
793,2015-03-05 00:00:00,2015-03-05,1^ALEX,2.0,03-05,2015,3,Alexandra Bridge
794,2015-03-06 00:00:00,2015-03-06,1^ALEX,7.0,03-06,2015,3,Alexandra Bridge
795,2015-03-07 00:00:00,2015-03-07,1^ALEX,0.0,03-07,2015,3,Alexandra Bridge
796,2015-03-08 00:00:00,2015-03-08,1^ALEX,2.0,03-08,2015,3,Alexandra Bridge
797,2015-03-09 00:00:00,2015-03-09,1^ALEX,13.0,03-09,2015,3,Alexandra Bridge
798,2015-03-10 00:00:00,2015-03-10,1^ALEX,38.0,03-10,2015,3,Alexandra Bridge
799,2015-03-11 00:00:00,2015-03-11,1^ALEX,83.0,03-11,2015,3,Alexandra Bridge
800,2015-03-12 00:00:00,2015-03-12,1^ALEX,57.0,03-12,2015,3,Alexandra Bridge
801,2015-03-13 00:00:00,2015-03-13,1^ALEX,19.0,03-13,2015,3,Alexandra Bridge
802,2015-03-14 00:00:00,2015-03-14,1^ALEX,3.0,03-14,2015,3,Alexandra Bridge
803,2015-03-15 00:00:00,2015-03-15,1^ALEX,2.0,03-15,2015,3,Alexandra Bridge
804,2015-03-16 00:00:00,2015-03-16,1^ALEX,68.0,03-16,2015,3,Alexandra Bridge
805,2015-03-17 00:00:00,2015-03-17,1^ALEX,106.0,03-17,2015,3,Alexandra Bridge
806,2015-03-18 00:00:00,2015-03-18,1^ALEX,127.0,03-18,2015,3,Alexandra Bridge
807,2015-03-19 00:00:00,2015-03-19,1^ALEX,186.0,03-19,2015,3,Alexandra Bridge
808,2015-03-20 00:00:00,2015-03-20,1^ALEX,210.0,03-20,2015,3,Alexandra Bridge
809,2015-03-21 00:00:00,2015-03-21,1^ALEX,48.0,03-21,2015,3,Alexandra Bridge
810,2015-03-22 00:00:00,2015-03-22,1^ALEX,38.0,03-22,2015,3,Alexandra Bridge
811,2015-03-23 00:00:00,2015-03-23,1^ALEX,154.0,03-23,2015,3,Alexandra Bridge
812,2015-03-24 00:00:00,2015-03-24,1^ALEX,258.0,03-24,2015,3,Alexandra Bridge
813,2015-03-25 00:00:00,2015-03-25,1^ALEX,349.0,03-25,2015,3,Alexandra Bridge
814,2015-03-26 00:00:00,2015-03-26,1^ALEX,312.0,03-26,2015,3,Alexandra Bridge
815,2015-03-27 00:00:00,2015-03-27,1^ALEX,186.0,03-27,2015,3,Alexandra Bridge
816,2015-03-28 00:00:00,2015-03-28,1^ALEX,106.0,03-28,2015,3,Alexandra Bridge
817,2015-03-29 00:00:00,2015-03-29,1^ALEX,155.0,03-29,2015,3,Alexandra Bridge
818,2015-03-30 00:00:00,2015-03-30,1^ALEX,279.0,03-30,2015,3,Alexandra Bridge
819,2015-03-31 00:00:00,2015-03-31,1^ALEX,379.0,03-31,2015,3,Alexandra Bridge
820,2015-04-01 00:00:00,2015-04-01,1^ALEX,507.0,04-01,2015,4,Alexandra Bridge
821,2015-04-02 00:00:00,2015-04-02,1^ALEX,338.0,04-02,2015,4,Alexandra Bridge
822,2015-04-03 00:00:00,2015-04-03,1^ALEX,567.0,04-03,2015,4,Alexandra Bridge
823,2015-04-04 00:00:00,2015-04-04,1^ALEX,122.0,04-04,2015,4,Alexandra Bridge
824,2015-04-05 00:00:00,2015-04-05,1^ALEX,207.0,04-05,2015,4,Alexandra Bridge
825,2015-04-06 00:00:00,2015-04-06,1^ALEX,159.0,04-06,2015,4,Alexandra Bridge
826,2015-04-07 00:00:00,2015-04-07,1^ALEX,678.0,04-07,2015,4,Alexandra Bridge
827,2015-04-08 00:00:00,2015-04-08,1^ALEX,626.0,04-08,2015,4,Alexandra Bridge
828,2015-04-09 00:00:00,2015-04-09,1^ALEX,540.0,04-09,2015,4,Alexandra Bridge
829,2015-04-10 00:00:00,2015-04-10,1^ALEX,391.0,04-10,2015,4,Alexandra Bridge
830,2015-04-11 00:00:00,2015-04-11,1^ALEX,330.0,04-11,2015,4,Alexandra Bridge
831,2015-04-12 00:00:00,2015-04-12,1^ALEX,1187.0,04-12,2015,4,Alexandra Bridge
832,2015-04-13 00:00:00,2015-04-13,1^ALEX,1310.0,04-13,2015,4,Alexandra Bridge
833,2015-04-14 00:00:00,2015-04-14,1^ALEX,1360.0,04-14,2015,4,Alexandra Bridge
834,2015-04-15 00:00:00,2015-04-15,1^ALEX,1350.0,04-15,2015,4,Alexandra Bridge
835,2015-04-16 00:00:00,2015-04-16,1^ALEX,1489.0,04-16,2015,4,Alexandra Bridge
836,2015-04-17 00:00:00,2015-04-17,1^ALEX,1398.0,04-17,2015,4,Alexandra Bridge
837,2015-04-18 00:00:00,2015-04-18,1^ALEX,702.0,04-18,2015,4,Alexandra Bridge
838,2015-04-19 00:00:00,2015-04-19,1^ALEX,946.0,04-19,2015,4,Alexandra Bridge
839,2015-04-20 00:00:00,2015-04-20,1^ALEX,522.0,04-20,2015,4,Alexandra Bridge
840,2015-04-21 00:00:00,2015-04-21,1^ALEX,634.0,04-21,2015,4,Alexandra Bridge
841,2015-04-22 00:00:00,2015-04-22,1^ALEX,780.0,04-22,2015,4,Alexandra Bridge
842,2015-04-23 00:00:00,2015-04-23,1^ALEX,926.0,04-23,2015,4,Alexandra Bridge
843,2015-04-24 00:00:00,2015-04-24,1^ALEX,821.0,04-24,2015,4,Alexandra Bridge
844,2015-04-25 00:00:00,2015-04-25,1^ALEX,715.0,04-25,2015,4,Alexandra Bridge
845,2015-04-26 00:00:00,2015-04-26,1^ALEX,734.0,04-26,2015,4,Alexandra Bridge
846,2015-04-27 00:00:00,2015-04-27,1^ALEX,1199.0,04-27,2015,4,Alexandra Bridge
847,2015-04-28 00:00:00,2015-04-28,1^ALEX,1860.0,04-28,2015,4,Alexandra Bridge
848,2015-04-29 00:00:00,2015-04-29,1^ALEX,1846.0,04-29,2015,4,Alexandra Bridge
849,2015-04-30 00:00:00,2015-04-30,1^ALEX,1809.0,04-30,2015,4,Alexandra Bridge
850,2015-05-01 00:00:00,2015-05-01,1^ALEX,1715.0,05-01,2015,5,Alexandra Bridge
851,2015-05-02 00:00:00,2015-05-02,1^ALEX,1682.0,05-02,2015,5,Alexandra Bridge
852,2015-05-03 00:00:00,2015-05-03,1^ALEX,1855.0,05-03,2015,5,Alexandra Bridge
853,2015-05-04 00:00:00,2015-05-04,1^ALEX,1727.0,05-04,2015,5,Alexandra Bridge
854,2015-05-05 00:00:00,2015-05-05,1^ALEX,2336.0,05-05,2015,5,Alexandra Bridge
855,2015-05-06 00:00:00,2015-05-06,1^ALEX,2710.0,05-06,2015,5,Alexandra Bridge
856,2015-05-07 00:00:00,2015-05-07,1^ALEX,2512.0,05-07,2015,5,Alexandra Bridge
857,2015-05-08 00:00:00,2015-05-08,1^ALEX,2341.0,05-08,2015,5,Alexandra Bridge
858,2015-05-09 00:00:00,2015-05-09,1^ALEX,1178.0,05-09,2015,5,Alexandra Bridge
859,2015-05-10 00:00:00,2015-05-10,1^ALEX,773.0,05-10,2015,5,Alexandra Bridge
860,2015-05-11 00:00:00,2015-05-11,1^ALEX,871.0,05-11,2015,5,Alexandra Bridge
861,2015-05-12 00:00:00,2015-05-12,1^ALEX,1525.0,05-12,2015,5,Alexandra Bridge
862,2015-05-13 00:00:00,2015-05-13,1^ALEX,2286.0,05-13,2015,5,Alexandra Bridge
863,2015-05-14 00:00:00,2015-05-14,1^ALEX,2527.0,05-14,2015,5,Alexandra Bridge
864,2015-05-15 00:00:00,2015-05-15,1^ALEX,2182.0,05-15,2015,5,Alexandra Bridge
865,2015-05-16 00:00:00,2015-05-16,1^ALEX,989.0,05-16,2015,5,Alexandra Bridge
866,2015-05-17 00:00:00,2015-05-17,1^ALEX,3040.0,05-17,2015,5,Alexandra Bridge
867,2015-05-18 00:00:00,2015-05-18,1^ALEX,1783.0,05-18,2015,5,Alexandra Bridge
868,2015-05-19 00:00:00,2015-05-19,1^ALEX,2399.0,05-19,2015,5,Alexandra Bridge
869,2015-05-20 00:00:00,2015-05-20,1^ALEX,2133.0,05-20,2015,5,Alexandra Bridge
870,2015-05-21 00:00:00,2015-05-21,1^ALEX,2547.0,05-21,2015,5,Alexandra Bridge
871,2015-05-22 00:00:00,2015-05-22,1^ALEX,1742.0,05-22,2015,5,Alexandra Bridge
872,2015-05-23 00:00:00,2015-05-23,1^ALEX,1468.0,05-23,2015,5,Alexandra Bridge
873,2015-05-24 00:00:00,2015-05-24,1^ALEX,2016.0,05-24,2015,5,Alexandra Bridge
874,2015-05-25 00:00:00,2015-05-25,1^ALEX,1138.0,05-25,2015,5,Alexandra Bridge
875,2015-05-26 00:00:00,2015-05-26,1^ALEX,2336.0,05-26,2015,5,Alexandra Bridge
876,2015-05-27 00:00:00,2015-05-27,1^ALEX,2220.0,05-27,2015,5,Alexandra Bridge
877,2015-05-28 00:00:00,2015-05-28,1^ALEX,2036.0,05-28,2015,5,Alexandra Bridge
878,2015-05-29 00:00:00,2015-05-29,1^ALEX,2782.0,05-29,2015,5,Alexandra Bridge
879,2015-05-30 00:00:00,2015-05-30,1^ALEX,1057.0,05-30,2015,5,Alexandra Bridge
880,2015-05-31 00:00:00,2015-05-31,1^ALEX,1076.0,05-31,2015,5,Alexandra Bridge
881,2015-06-01 00:00:00,2015-06-01,1^ALEX,2106.0,06-01,2015,6,Alexandra Bridge
882,2015-06-02 00:00:00,2015-06-02,1^ALEX,2056.0,06-02,2015,6,Alexandra Bridge
883,2015-06-03 00:00:00,2015-06-03,1^ALEX,2873.0,06-03,2015,6,Alexandra Bridge
884,2015-06-04 00:00:00,2015-06-04,1^ALEX,3166.0,06-04,2015,6,Alexandra Bridge
885,2015-06-05 00:00:00,2015-06-05,1^ALEX,1619.0,06-05,2015,6,Alexandra Bridge
886,2015-06-06 00:00:00,2015-06-06,1^ALEX,1789.0,06-06,2015,6,Alexandra Bridge
887,2015-06-07 00:00:00,2015-06-07,1^ALEX,1931.0,06-07,2015,6,Alexandra Bridge
888,2015-06-08 00:00:00,2015-06-08,1^ALEX,844.0,06-08,2015,6,Alexandra Bridge
889,2015-06-09 00:00:00,2015-06-09,1^ALEX,1599.0,06-09,2015,6,Alexandra Bridge
890,2015-06-10 00:00:00,2015-06-10,1^ALEX,2056.0,06-10,2015,6,Alexandra Bridge
891,2015-06-11 00:00:00,2015-06-11,1^ALEX,2685.0,06-11,2015,6,Alexandra Bridge
892,2015-06-12 00:00:00,2015-06-12,1^ALEX,1196.0,06-12,2015,6,Alexandra Bridge
893,2015-06-13 00:00:00,2015-06-13,1^ALEX,1999.0,06-13,2015,6,Alexandra Bridge
894,2015-06-14 00:00:00,2015-06-14,1^ALEX,2122.0,06-14,2015,6,Alexandra Bridge
895,2015-06-15 00:00:00,2015-06-15,1^ALEX,2329.0,06-15,2015,6,Alexandra Bridge
896,2015-06-16 00:00:00,2015-06-16,1^ALEX,1231.0,06-16,2015,6,Alexandra Bridge
897,2015-06-17 00:00:00,2015-06-17,1^ALEX,3134.0,06-17,2015,6,Alexandra Bridge
898,2015-06-18 00:00:00,2015-06-18,1^ALEX,2952.0,06-18,2015,6,Alexandra Bridge
899,2015-06-19 00:00:00,2015-06-19,1^ALEX,2695.0,06-19,2015,6,Alexandra Bridge
900,2015-06-20 00:00:00,2015-06-20,1^ALEX,2382.0,06-20,2015,6,Alexandra Bridge
901,2015-06-21 00:00:00,2015-06-21,1^ALEX,1099.0,06-21,2015,6,Alexandra Bridge
902,2015-06-22 00:00:00,2015-06-22,1^ALEX,3027.0,06-22,2015,6,Alexandra Bridge
903,2015-06-23 00:00:00,2015-06-23,1^ALEX,2081.0,06-23,2015,6,Alexandra Bridge
904,2015-06-24 00:00:00,2015-06-24,1^ALEX,2780.0,06-24,2015,6,Alexandra Bridge
905,2015-06-25 00:00:00,2015-06-25,1^ALEX,2837.0,06-25,2015,6,Alexandra Bridge
906,2015-06-26 00:00:00,2015-06-26,1^ALEX,2794.0,06-26,2015,6,Alexandra Bridge
907,2015-06-27 00:00:00,2015-06-27,1^ALEX,2038.0,06-27,2015,6,Alexandra Bridge
908,2015-06-28 00:00:00,2015-06-28,1^ALEX,358.0,06-28,2015,6,Alexandra Bridge
909,2015-06-29 00:00:00,2015-06-29,1^ALEX,1984.0,06-29,2015,6,Alexandra Bridge
910,2015-06-30 00:00:00,2015-06-30,1^ALEX,2476.0,06-30,2015,6,Alexandra Bridge
911,2015-07-01 00:00:00,2015-07-01,1^ALEX,280.0,07-01,2015,7,Alexandra Bridge
912,2015-07-02 00:00:00,2015-07-02,1^ALEX,3052.0,07-02,2015,7,Alexandra Bridge
913,2015-07-03 00:00:00,2015-07-03,1^ALEX,2768.0,07-03,2015,7,Alexandra Bridge
914,2015-07-04 00:00:00,2015-07-04,1^ALEX,2134.0,07-04,2015,7,Alexandra Bridge
915,2015-07-05 00:00:00,2015-07-05,1^ALEX,2287.0,07-05,2015,7,Alexandra Bridge
916,2015-07-06 00:00:00,2015-07-06,1^ALEX,2700.0,07-06,2015,7,Alexandra Bridge
917,2015-07-07 00:00:00,2015-07-07,1^ALEX,2247.0,07-07,2015,7,Alexandra Bridge
918,2015-07-08 00:00:00,2015-07-08,1^ALEX,2904.0,07-08,2015,7,Alexandra Bridge
919,2015-07-09 00:00:00,2015-07-09,1^ALEX,2630.0,07-09,2015,7,Alexandra Bridge
920,2015-07-10 00:00:00,2015-07-10,1^ALEX,2650.0,07-10,2015,7,Alexandra Bridge
921,2015-07-11 00:00:00,2015-07-11,1^ALEX,1770.0,07-11,2015,7,Alexandra Bridge
922,2015-07-12 00:00:00,2015-07-12,1^ALEX,1742.0,07-12,2015,7,Alexandra Bridge
923,2015-07-13 00:00:00,2015-07-13,1^ALEX,2532.0,07-13,2015,7,Alexandra Bridge
924,2015-07-14 00:00:00,2015-07-14,1^ALEX,2196.0,07-14,2015,7,Alexandra Bridge
925,2015-07-15 00:00:00,2015-07-15,1^ALEX,2755.0,07-15,2015,7,Alexandra Bridge
926,2015-07-16 00:00:00,2015-07-16,1^ALEX,2905.0,07-16,2015,7,Alexandra Bridge
927,2015-07-17 00:00:00,2015-07-17,1^ALEX,1908.0,07-17,2015,7,Alexandra Bridge
928,2015-07-18 00:00:00,2015-07-18,1^ALEX,1464.0,07-18,2015,7,Alexandra Bridge
929,2015-07-19 00:00:00,2015-07-19,1^ALEX,1346.0,07-19,2015,7,Alexandra Bridge
930,2015-07-20 00:00:00,2015-07-20,1^ALEX,2688.0,07-20,2015,7,Alexandra Bridge
931,2015-07-21 00:00:00,2015-07-21,1^ALEX,2090.0,07-21,2015,7,Alexandra Bridge
932,2015-07-22 00:00:00,2015-07-22,1^ALEX,2911.0,07-22,2015,7,Alexandra Bridge
933,2015-07-23 00:00:00,2015-07-23,1^ALEX,2812.0,07-23,2015,7,Alexandra Bridge
934,2015-07-24 00:00:00,2015-07-24,1^ALEX,2559.0,07-24,2015,7,Alexandra Bridge
935,2015-07-25 00:00:00,2015-07-25,1^ALEX,1473.0,07-25,2015,7,Alexandra Bridge
936,2015-07-26 00:00:00,2015-07-26,1^ALEX,1909.0,07-26,2015,7,Alexandra Bridge
937,2015-07-27 00:00:00,2015-07-27,1^ALEX,2401.0,07-27,2015,7,Alexandra Bridge
938,2015-07-28 00:00:00,2015-07-28,1^ALEX,2433.0,07-28,2015,7,Alexandra Bridge
939,2015-07-29 00:00:00,2015-07-29,1^ALEX,2302.0,07-29,2015,7,Alexandra Bridge
940,2015-07-30 00:00:00,2015-07-30,1^ALEX,1927.0,07-30,2015,7,Alexandra Bridge
941,2015-07-31 00:00:00,2015-07-31,1^ALEX,2011.0,07-31,2015,7,Alexandra Bridge
942,2015-08-01 00:00:00,2015-08-01,1^ALEX,1644.0,08-01,2015,8,Alexandra Bridge
943,2015-08-02 00:00:00,2015-08-02,1^ALEX,2244.0,08-02,2015,8,Alexandra Bridge
944,2015-08-03 00:00:00,2015-08-03,1^ALEX,1121.0,08-03,2015,8,Alexandra Bridge
945,2015-08-04 00:00:00,2015-08-04,1^ALEX,2452.0,08-04,2015,8,Alexandra Bridge
946,2015-08-05 00:00:00,2015-08-05,1^ALEX,2481.0,08-05,2015,8,Alexandra Bridge
947,2015-08-06 00:00:00,2015-08-06,1^ALEX,2514.0,08-06,2015,8,Alexandra Bridge
948,2015-08-07 00:00:00,2015-08-07,1^ALEX,2266.0,08-07,2015,8,Alexandra Bridge
949,2015-08-08 00:00:00,2015-08-08,1^ALEX,1817.0,08-08,2015,8,Alexandra Bridge
950,2015-08-09 00:00:00,2015-08-09,1^ALEX,2130.0,08-09,2015,8,Alexandra Bridge
951,2015-08-10 00:00:00,2015-08-10,1^ALEX,2441.0,08-10,2015,8,Alexandra Bridge
952,2015-08-11 00:00:00,2015-08-11,1^ALEX,1005.0,08-11,2015,8,Alexandra Bridge
953,2015-08-12 00:00:00,2015-08-12,1^ALEX,2189.0,08-12,2015,8,Alexandra Bridge
954,2015-08-13 00:00:00,2015-08-13,1^ALEX,2554.0,08-13,2015,8,Alexandra Bridge
955,2015-08-14 00:00:00,2015-08-14,1^ALEX,1373.0,08-14,2015,8,Alexandra Bridge
956,2015-08-15 00:00:00,2015-08-15,1^ALEX,1477.0,08-15,2015,8,Alexandra Bridge
957,2015-08-16 00:00:00,2015-08-16,1^ALEX,1774.0,08-16,2015,8,Alexandra Bridge
958,2015-08-17 00:00:00,2015-08-17,1^ALEX,2179.0,08-17,2015,8,Alexandra Bridge
959,2015-08-18 00:00:00,2015-08-18,1^ALEX,2196.0,08-18,2015,8,Alexandra Bridge
960,2015-08-19 00:00:00,2015-08-19,1^ALEX,2232.0,08-19,2015,8,Alexandra Bridge
961,2015-08-20 00:00:00,2015-08-20,1^ALEX,1638.0,08-20,2015,8,Alexandra Bridge
962,2015-08-21 00:00:00,2015-08-21,1^ALEX,2272.0,08-21,2015,8,Alexandra Bridge
963,2015-08-22 00:00:00,2015-08-22,1^ALEX,1781.0,08-22,2015,8,Alexandra Bridge
964,2015-08-23 00:00:00,2015-08-23,1^ALEX,1941.0,08-23,2015,8,Alexandra Bridge
965,2015-08-24 00:00:00,2015-08-24,1^ALEX,2052.0,08-24,2015,8,Alexandra Bridge
966,2015-08-25 00:00:00,2015-08-25,1^ALEX,2415.0,08-25,2015,8,Alexandra Bridge
967,2015-08-26 00:00:00,2015-08-26,1^ALEX,2108.0,08-26,2015,8,Alexandra Bridge
968,2015-08-27 00:00:00,2015-08-27,1^ALEX,2166.0,08-27,2015,8,Alexandra Bridge
969,2015-08-28 00:00:00,2015-08-28,1^ALEX,2195.0,08-28,2015,8,Alexandra Bridge
970,2015-08-29 00:00:00,2015-08-29,1^ALEX,1360.0,08-29,2015,8,Alexandra Bridge
971,2015-08-30 00:00:00,2015-08-30,1^ALEX,1953.0,08-30,2015,8,Alexandra Bridge
972,2015-08-31 00:00:00,2015-08-31,1^ALEX,2418.0,08-31,2015,8,Alexandra Bridge
973,2015-09-01 00:00:00,2015-09-01,1^ALEX,2587.0,09-01,2015,9,Alexandra Bridge
974,2015-09-02 00:00:00,2015-09-02,1^ALEX,2309.0,09-02,2015,9,Alexandra Bridge
975,2015-09-03 00:00:00,2015-09-03,1^ALEX,2468.0,09-03,2015,9,Alexandra Bridge
976,2015-09-04 00:00:00,2015-09-04,1^ALEX,2361.0,09-04,2015,9,Alexandra Bridge
977,2015-09-05 00:00:00,2015-09-05,1^ALEX,1857.0,09-05,2015,9,Alexandra Bridge
978,2015-09-06 00:00:00,2015-09-06,1^ALEX,1784.0,09-06,2015,9,Alexandra Bridge
979,2015-09-07 00:00:00,2015-09-07,1^ALEX,1593.0,09-07,2015,9,Alexandra Bridge
980,2015-09-08 00:00:00,2015-09-08,1^ALEX,2066.0,09-08,2015,9,Alexandra Bridge
981,2015-09-09 00:00:00,2015-09-09,1^ALEX,1979.0,09-09,2015,9,Alexandra Bridge
982,2015-09-10 00:00:00,2015-09-10,1^ALEX,2638.0,09-10,2015,9,Alexandra Bridge
983,2015-09-11 00:00:00,2015-09-11,1^ALEX,2352.0,09-11,2015,9,Alexandra Bridge
984,2015-09-12 00:00:00,2015-09-12,1^ALEX,246.0,09-12,2015,9,Alexandra Bridge
985,2015-09-13 00:00:00,2015-09-13,1^ALEX,260.0,09-13,2015,9,Alexandra Bridge
986,2015-09-14 00:00:00,2015-09-14,1^ALEX,2274.0,09-14,2015,9,Alexandra Bridge
987,2015-09-15 00:00:00,2015-09-15,1^ALEX,2806.0,09-15,2015,9,Alexandra Bridge
988,2015-09-16 00:00:00,2015-09-16,1^ALEX,2720.0,09-16,2015,9,Alexandra Bridge
989,2015-09-17 00:00:00,2015-09-17,1^ALEX,2722.0,09-17,2015,9,Alexandra Bridge
990,2015-09-18 00:00:00,2015-09-18,1^ALEX,2493.0,09-18,2015,9,Alexandra Bridge
991,2015-09-19 00:00:00,2015-09-19,1^ALEX,889.0,09-19,2015,9,Alexandra Bridge
992,2015-09-20 00:00:00,2015-09-20,1^ALEX,1561.0,09-20,2015,9,Alexandra Bridge
993,2015-09-21 00:00:00,2015-09-21,1^ALEX,2490.0,09-21,2015,9,Alexandra Bridge
994,2015-09-22 00:00:00,2015-09-22,1^ALEX,2595.0,09-22,2015,9,Alexandra Bridge
995,2015-09-23 00:00:00,2015-09-23,1^ALEX,2529.0,09-23,2015,9,Alexandra Bridge
996,2015-09-24 00:00:00,2015-09-24,1^ALEX,2483.0,09-24,2015,9,Alexandra Bridge
997,2015-09-25 00:00:00,2015-09-25,1^ALEX,1955.0,09-25,2015,9,Alexandra Bridge
998,2015-09-26 00:00:00,2015-09-26,1^ALEX,1280.0,09-26,2015,9,Alexandra Bridge
999,2015-09-27 00:00:00,2015-09-27,1^ALEX,1677.0,09-27,2015,9,Alexandra Bridge
1000,2015-09-28 00:00:00,2015-09-28,1^ALEX,1610.0,09-28,2015,9,Alexandra Bridge
1001,2015-09-29 00:00:00,2015-09-29,1^ALEX,1252.0,09-29,2015,9,Alexandra Bridge
1002,2015-09-30 00:00:00,2015-09-30,1^ALEX,1780.0,09-30,2015,9,Alexandra Bridge
1003,2015-10-01 00:00:00,2015-10-01,1^ALEX,1891.0,10-01,2015,10,Alexandra Bridge
1004,2015-10-02 00:00:00,2015-10-02,1^ALEX,1632.0,10-02,2015,10,Alexandra Bridge
1005,2015-10-03 00:00:00,2015-10-03,1^ALEX,686.0,10-03,2015,10,Alexandra Bridge
1006,2015-10-04 00:00:00,2015-10-04,1^ALEX,731.0,10-04,2015,10,Alexandra Bridge
1007,2015-10-05 00:00:00,2015-10-05,1^ALEX,1643.0,10-05,2015,10,Alexandra Bridge
1008,2015-10-06 00:00:00,2015-10-06,1^ALEX,1900.0,10-06,2015,10,Alexandra Bridge
1009,2015-10-07 00:00:00,2015-10-07,1^ALEX,2040.0,10-07,2015,10,Alexandra Bridge
1010,2015-10-08 00:00:00,2015-10-08,1^ALEX,1800.0,10-08,2015,10,Alexandra Bridge
1011,2015-10-09 00:00:00,2015-10-09,1^ALEX,655.0,10-09,2015,10,Alexandra Bridge
1012,2015-10-10 00:00:00,2015-10-10,1^ALEX,691.0,10-10,2015,10,Alexandra Bridge
1013,2015-10-11 00:00:00,2015-10-11,1^ALEX,831.0,10-11,2015,10,Alexandra Bridge
1014,2015-10-12 00:00:00,2015-10-12,1^ALEX,1651.0,10-12,2015,10,Alexandra Bridge
1015,2015-10-13 00:00:00,2015-10-13,1^ALEX,1023.0,10-13,2015,10,Alexandra Bridge
1016,2015-10-14 00:00:00,2015-10-14,1^ALEX,1609.0,10-14,2015,10,Alexandra Bridge
1017,2015-10-15 00:00:00,2015-10-15,1^ALEX,1201.0,10-15,2015,10,Alexandra Bridge
1018,2015-10-16 00:00:00,2015-10-16,1^ALEX,1324.0,10-16,2015,10,Alexandra Bridge
1019,2015-10-17 00:00:00,2015-10-17,1^ALEX,494.0,10-17,2015,10,Alexandra Bridge
1020,2015-10-18 00:00:00,2015-10-18,1^ALEX,438.0,10-18,2015,10,Alexandra Bridge
1021,2015-10-19 00:00:00,2015-10-19,1^ALEX,1115.0,10-19,2015,10,Alexandra Bridge
1022,2015-10-20 00:00:00,2015-10-20,1^ALEX,1723.0,10-20,2015,10,Alexandra Bridge
1023,2015-10-21 00:00:00,2015-10-21,1^ALEX,1481.0,10-21,2015,10,Alexandra Bridge
1024,2015-10-22 00:00:00,2015-10-22,1^ALEX,1438.0,10-22,2015,10,Alexandra Bridge
1025,2015-10-23 00:00:00,2015-10-23,1^ALEX,1331.0,10-23,2015,10,Alexandra Bridge
1026,2015-10-24 00:00:00,2015-10-24,1^ALEX,442.0,10-24,2015,10,Alexandra Bridge
1027,2015-10-25 00:00:00,2015-10-25,1^ALEX,393.0,10-25,2015,10,Alexandra Bridge
1028,2015-10-26 00:00:00,2015-10-26,1^ALEX,1382.0,10-26,2015,10,Alexandra Bridge
1029,2015-10-27 00:00:00,2015-10-27,1^ALEX,1646.0,10-27,2015,10,Alexandra Bridge
1030,2015-10-28 00:00:00,2015-10-28,1^ALEX,641.0,10-28,2015,10,Alexandra Bridge
1031,2015-10-29 00:00:00,2015-10-29,1^ALEX,985.0,10-29,2015,10,Alexandra Bridge
1032,2015-10-30 00:00:00,2015-10-30,1^ALEX,1119.0,10-30,2015,10,Alexandra Bridge
1033,2015-10-31 00:00:00,2015-10-31,1^ALEX,422.0,10-31,2015,10,Alexandra Bridge
1034,2015-11-01 00:00:00,2015-11-01,1^ALEX,252.0,11-01,2015,11,Alexandra Bridge
1035,2015-11-02 00:00:00,2015-11-02,1^ALEX,1424.0,11-02,2015,11,Alexandra Bridge
1036,2015-11-03 00:00:00,2015-11-03,1^ALEX,1782.0,11-03,2015,11,Alexandra Bridge
1037,2015-11-04 00:00:00,2015-11-04,1^ALEX,1715.0,11-04,2015,11,Alexandra Bridge
1038,2015-11-05 00:00:00,2015-11-05,1^ALEX,1873.0,11-05,2015,11,Alexandra Bridge
1039,2015-11-06 00:00:00,2015-11-06,1^ALEX,960.0,11-06,2015,11,Alexandra Bridge
1040,2015-11-07 00:00:00,2015-11-07,1^ALEX,490.0,11-07,2015,11,Alexandra Bridge
1041,2015-11-08 00:00:00,2015-11-08,1^ALEX,508.0,11-08,2015,11,Alexandra Bridge
1042,2015-11-09 00:00:00,2015-11-09,1^ALEX,1332.0,11-09,2015,11,Alexandra Bridge
1043,2015-11-10 00:00:00,2015-11-10,1^ALEX,1301.0,11-10,2015,11,Alexandra Bridge
1044,2015-11-11 00:00:00,2015-11-11,1^ALEX,710.0,11-11,2015,11,Alexandra Bridge
1045,2015-11-12 00:00:00,2015-11-12,1^ALEX,686.0,11-12,2015,11,Alexandra Bridge
1046,2015-11-13 00:00:00,2015-11-13,1^ALEX,655.0,11-13,2015,11,Alexandra Bridge
1047,2015-11-14 00:00:00,2015-11-14,1^ALEX,251.0,11-14,2015,11,Alexandra Bridge
1048,2015-11-15 00:00:00,2015-11-15,1^ALEX,355.0,11-15,2015,11,Alexandra Bridge
1049,2015-11-16 00:00:00,2015-11-16,1^ALEX,1194.0,11-16,2015,11,Alexandra Bridge
1050,2015-11-17 00:00:00,2015-11-17,1^ALEX,979.0,11-17,2015,11,Alexandra Bridge
1051,2015-11-18 00:00:00,2015-11-18,1^ALEX,1115.0,11-18,2015,11,Alexandra Bridge
1052,2015-11-19 00:00:00,2015-11-19,1^ALEX,738.0,11-19,2015,11,Alexandra Bridge
1053,2015-11-20 00:00:00,2015-11-20,1^ALEX,990.0,11-20,2015,11,Alexandra Bridge
1054,2015-11-21 00:00:00,2015-11-21,1^ALEX,365.0,11-21,2015,11,Alexandra Bridge
1055,2015-11-22 00:00:00,2015-11-22,1^ALEX,225.0,11-22,2015,11,Alexandra Bridge
1056,2015-11-23 00:00:00,2015-11-23,1^ALEX,915.0,11-23,2015,11,Alexandra Bridge
1057,2015-11-24 00:00:00,2015-11-24,1^ALEX,419.0,11-24,2015,11,Alexandra Bridge
1058,2015-11-25 00:00:00,2015-11-25,1^ALEX,586.0,11-25,2015,11,Alexandra Bridge
1059,2015-11-26 00:00:00,2015-11-26,1^ALEX,860.0,11-26,2015,11,Alexandra Bridge
1060,2015-11-27 00:00:00,2015-11-27,1^ALEX,585.0,11-27,2015,11,Alexandra Bridge
1061,2015-11-28 00:00:00,2015-11-28,1^ALEX,254.0,11-28,2015,11,Alexandra Bridge
1062,2015-11-29 00:00:00,2015-11-29,1^ALEX,268.0,11-29,2015,11,Alexandra Bridge
1063,2015-11-30 00:00:00,2015-11-30,1^ALEX,714.0,11-30,2015,11,Alexandra Bridge
1064,2015-12-01 00:00:00,2015-12-01,1^ALEX,520.0,12-01,2015,12,Alexandra Bridge
1065,2015-12-02 00:00:00,2015-12-02,1^ALEX,505.0,12-02,2015,12,Alexandra Bridge
1066,2015-12-03 00:00:00,2015-12-03,1^ALEX,622.0,12-03,2015,12,Alexandra Bridge
1067,2015-12-04 00:00:00,2015-12-04,1^ALEX,624.0,12-04,2015,12,Alexandra Bridge
1068,2015-12-05 00:00:00,2015-12-05,1^ALEX,378.0,12-05,2015,12,Alexandra Bridge
1069,2015-12-06 00:00:00,2015-12-06,1^ALEX,370.0,12-06,2015,12,Alexandra Bridge
1070,2015-12-07 00:00:00,2015-12-07,1^ALEX,791.0,12-07,2015,12,Alexandra Bridge
1071,2015-12-08 00:00:00,2015-12-08,1^ALEX,805.0,12-08,2015,12,Alexandra Bridge
1072,2015-12-09 00:00:00,2015-12-09,1^ALEX,862.0,12-09,2015,12,Alexandra Bridge
1073,2015-12-10 00:00:00,2015-12-10,1^ALEX,876.0,12-10,2015,12,Alexandra Bridge
1074,2015-12-11 00:00:00,2015-12-11,1^ALEX,679.0,12-11,2015,12,Alexandra Bridge
1075,2015-12-12 00:00:00,2015-12-12,1^ALEX,392.0,12-12,2015,12,Alexandra Bridge
1076,2015-12-13 00:00:00,2015-12-13,1^ALEX,216.0,12-13,2015,12,Alexandra Bridge
1077,2015-12-14 00:00:00,2015-12-14,1^ALEX,532.0,12-14,2015,12,Alexandra Bridge
1078,2015-12-15 00:00:00,2015-12-15,1^ALEX,538.0,12-15,2015,12,Alexandra Bridge
1079,2015-12-16 00:00:00,2015-12-16,1^ALEX,689.0,12-16,2015,12,Alexandra Bridge
1080,2015-12-17 00:00:00,2015-12-17,1^ALEX,423.0,12-17,2015,12,Alexandra Bridge
1081,2015-12-18 00:00:00,2015-12-18,1^ALEX,572.0,12-18,2015,12,Alexandra Bridge
1082,2015-12-19 00:00:00,2015-12-19,1^ALEX,143.0,12-19,2015,12,Alexandra Bridge
1083,2015-12-20 00:00:00,2015-12-20,1^ALEX,131.0,12-20,2015,12,Alexandra Bridge
1084,2015-12-21 00:00:00,2015-12-21,1^ALEX,286.0,12-21,2015,12,Alexandra Bridge
1085,2015-12-22 00:00:00,2015-12-22,1^ALEX,278.0,12-22,2015,12,Alexandra Bridge
1086,2015-12-23 00:00:00,2015-12-23,1^ALEX,405.0,12-23,2015,12,Alexandra Bridge
1087,2015-12-24 00:00:00,2015-12-24,1^ALEX,419.0,12-24,2015,12,Alexandra Bridge
1088,2015-12-25 00:00:00,2015-12-25,1^ALEX,173.0,12-25,2015,12,Alexandra Bridge
1089,2015-12-26 00:00:00,2015-12-26,1^ALEX,225.0,12-26,2015,12,Alexandra Bridge
1090,2015-12-27 00:00:00,2015-12-27,1^ALEX,53.0,12-27,2015,12,Alexandra Bridge
1091,2015-12-28 00:00:00,2015-12-28,1^ALEX,46.0,12-28,2015,12,Alexandra Bridge
1092,2015-12-29 00:00:00,2015-12-29,1^ALEX,4.0,12-29,2015,12,Alexandra Bridge
1093,2015-12-30 00:00:00,2015-12-30,1^ALEX,2.0,12-30,2015,12,Alexandra Bridge
1094,2015-12-31 00:00:00,2015-12-31,1^ALEX,1.0,12-31,2015,12,Alexandra Bridge
1095,2016-01-01 00:00:00,2016-01-01,1^ALEX,0.0,01-01,2016,1,Alexandra Bridge
1096,2016-01-02 00:00:00,2016-01-02,1^ALEX,0.0,01-02,2016,1,Alexandra Bridge
1097,2016-01-03 00:00:00,2016-01-03,1^ALEX,1.0,01-03,2016,1,Alexandra Bridge
1098,2016-01-04 00:00:00,2016-01-04,1^ALEX,1.0,01-04,2016,1,Alexandra Bridge
1099,2016-01-05 00:00:00,2016-01-05,1^ALEX,2.0,01-05,2016,1,Alexandra Bridge
1100,2016-01-06 00:00:00,2016-01-06,1^ALEX,3.0,01-06,2016,1,Alexandra Bridge
1101,2016-01-07 00:00:00,2016-01-07,1^ALEX,2.0,01-07,2016,1,Alexandra Bridge
1102,2016-01-08 00:00:00,2016-01-08,1^ALEX,5.0,01-08,2016,1,Alexandra Bridge
1103,2016-01-09 00:00:00,2016-01-09,1^ALEX,3.0,01-09,2016,1,Alexandra Bridge
1104,2016-01-10 00:00:00,2016-01-10,1^ALEX,2.0,01-10,2016,1,Alexandra Bridge
1105,2016-01-11 00:00:00,2016-01-11,1^ALEX,1.0,01-11,2016,1,Alexandra Bridge
1106,2016-01-12 00:00:00,2016-01-12,1^ALEX,0.0,01-12,2016,1,Alexandra Bridge
1107,2016-01-13 00:00:00,2016-01-13,1^ALEX,0.0,01-13,2016,1,Alexandra Bridge
1108,2016-01-14 00:00:00,2016-01-14,1^ALEX,4.0,01-14,2016,1,Alexandra Bridge
1109,2016-01-15 00:00:00,2016-01-15,1^ALEX,3.0,01-15,2016,1,Alexandra Bridge
1110,2016-01-16 00:00:00,2016-01-16,1^ALEX,0.0,01-16,2016,1,Alexandra Bridge
1111,2016-01-17 00:00:00,2016-01-17,1^ALEX,2.0,01-17,2016,1,Alexandra Bridge
1112,2016-01-18 00:00:00,2016-01-18,1^ALEX,3.0,01-18,2016,1,Alexandra Bridge
1113,2016-01-19 00:00:00,2016-01-19,1^ALEX,0.0,01-19,2016,1,Alexandra Bridge
1114,2016-01-20 00:00:00,2016-01-20,1^ALEX,0.0,01-20,2016,1,Alexandra Bridge
1115,2016-01-21 00:00:00,2016-01-21,1^ALEX,0.0,01-21,2016,1,Alexandra Bridge
1116,2016-01-22 00:00:00,2016-01-22,1^ALEX,0.0,01-22,2016,1,Alexandra Bridge
1117,2016-01-23 00:00:00,2016-01-23,1^ALEX,0.0,01-23,2016,1,Alexandra Bridge
1118,2016-01-24 00:00:00,2016-01-24,1^ALEX,0.0,01-24,2016,1,Alexandra Bridge
1119,2016-01-25 00:00:00,2016-01-25,1^ALEX,2.0,01-25,2016,1,Alexandra Bridge
1120,2016-01-26 00:00:00,2016-01-26,1^ALEX,0.0,01-26,2016,1,Alexandra Bridge
1121,2016-01-27 00:00:00,2016-01-27,1^ALEX,0.0,01-27,2016,1,Alexandra Bridge
1122,2016-01-28 00:00:00,2016-01-28,1^ALEX,0.0,01-28,2016,1,Alexandra Bridge
1123,2016-01-29 00:00:00,2016-01-29,1^ALEX,1.0,01-29,2016,1,Alexandra Bridge
1124,2016-01-30 00:00:00,2016-01-30,1^ALEX,0.0,01-30,2016,1,Alexandra Bridge
1125,2016-01-31 00:00:00,2016-01-31,1^ALEX,1.0,01-31,2016,1,Alexandra Bridge
1126,2016-02-01 00:00:00,2016-02-01,1^ALEX,12.0,02-01,2016,2,Alexandra Bridge
1127,2016-02-02 00:00:00,2016-02-02,1^ALEX,13.0,02-02,2016,2,Alexandra Bridge
1128,2016-02-03 00:00:00,2016-02-03,1^ALEX,11.0,02-03,2016,2,Alexandra Bridge
1129,2016-02-04 00:00:00,2016-02-04,1^ALEX,23.0,02-04,2016,2,Alexandra Bridge
1130,2016-02-05 00:00:00,2016-02-05,1^ALEX,11.0,02-05,2016,2,Alexandra Bridge
1131,2016-02-06 00:00:00,2016-02-06,1^ALEX,10.0,02-06,2016,2,Alexandra Bridge
1132,2016-02-07 00:00:00,2016-02-07,1^ALEX,7.0,02-07,2016,2,Alexandra Bridge
1133,2016-02-08 00:00:00,2016-02-08,1^ALEX,10.0,02-08,2016,2,Alexandra Bridge
1134,2016-02-09 00:00:00,2016-02-09,1^ALEX,17.0,02-09,2016,2,Alexandra Bridge
1135,2016-02-10 00:00:00,2016-02-10,1^ALEX,2.0,02-10,2016,2,Alexandra Bridge
1136,2016-02-11 00:00:00,2016-02-11,1^ALEX,1.0,02-11,2016,2,Alexandra Bridge
1137,2016-02-12 00:00:00,2016-02-12,1^ALEX,2.0,02-12,2016,2,Alexandra Bridge
1138,2016-02-13 00:00:00,2016-02-13,1^ALEX,0.0,02-13,2016,2,Alexandra Bridge
1139,2016-02-14 00:00:00,2016-02-14,1^ALEX,0.0,02-14,2016,2,Alexandra Bridge
1140,2016-02-15 00:00:00,2016-02-15,1^ALEX,4.0,02-15,2016,2,Alexandra Bridge
1141,2016-02-16 00:00:00,2016-02-16,1^ALEX,14.0,02-16,2016,2,Alexandra Bridge
1142,2016-02-17 00:00:00,2016-02-17,1^ALEX,0.0,02-17,2016,2,Alexandra Bridge
1143,2016-02-18 00:00:00,2016-02-18,1^ALEX,0.0,02-18,2016,2,Alexandra Bridge
1144,2016-02-19 00:00:00,2016-02-19,1^ALEX,2.0,02-19,2016,2,Alexandra Bridge
1145,2016-02-20 00:00:00,2016-02-20,1^ALEX,0.0,02-20,2016,2,Alexandra Bridge
1146,2016-02-21 00:00:00,2016-02-21,1^ALEX,2.0,02-21,2016,2,Alexandra Bridge
1147,2016-02-22 00:00:00,2016-02-22,1^ALEX,0.0,02-22,2016,2,Alexandra Bridge
1148,2016-02-23 00:00:00,2016-02-23,1^ALEX,3.0,02-23,2016,2,Alexandra Bridge
1149,2016-02-24 00:00:00,2016-02-24,1^ALEX,4.0,02-24,2016,2,Alexandra Bridge
1150,2016-02-25 00:00:00,2016-02-25,1^ALEX,8.0,02-25,2016,2,Alexandra Bridge
1151,2016-02-26 00:00:00,2016-02-26,1^ALEX,0.0,02-26,2016,2,Alexandra Bridge
1152,2016-02-27 00:00:00,2016-02-27,1^ALEX,0.0,02-27,2016,2,Alexandra Bridge
1153,2016-02-28 00:00:00,2016-02-28,1^ALEX,0.0,02-28,2016,2,Alexandra Bridge
1154,2016-02-29 00:00:00,2016-02-29,1^ALEX,4.0,02-29,2016,2,Alexandra Bridge
1155,2016-03-01 00:00:00,2016-03-01,1^ALEX,1.0,03-01,2016,3,Alexandra Bridge
1156,2016-03-02 00:00:00,2016-03-02,1^ALEX,1.0,03-02,2016,3,Alexandra Bridge
1157,2016-03-03 00:00:00,2016-03-03,1^ALEX,0.0,03-03,2016,3,Alexandra Bridge
1158,2016-03-04 00:00:00,2016-03-04,1^ALEX,0.0,03-04,2016,3,Alexandra Bridge
1159,2016-03-05 00:00:00,2016-03-05,1^ALEX,0.0,03-05,2016,3,Alexandra Bridge
1160,2016-03-06 00:00:00,2016-03-06,1^ALEX,0.0,03-06,2016,3,Alexandra Bridge
1161,2016-03-07 00:00:00,2016-03-07,1^ALEX,0.0,03-07,2016,3,Alexandra Bridge
1162,2016-03-08 00:00:00,2016-03-08,1^ALEX,1.0,03-08,2016,3,Alexandra Bridge
1163,2016-03-09 00:00:00,2016-03-09,1^ALEX,1.0,03-09,2016,3,Alexandra Bridge
1164,2016-03-10 00:00:00,2016-03-10,1^ALEX,6.0,03-10,2016,3,Alexandra Bridge
1165,2016-03-11 00:00:00,2016-03-11,1^ALEX,27.0,03-11,2016,3,Alexandra Bridge
1166,2016-03-12 00:00:00,2016-03-12,1^ALEX,67.0,03-12,2016,3,Alexandra Bridge
1167,2016-03-13 00:00:00,2016-03-13,1^ALEX,119.0,03-13,2016,3,Alexandra Bridge
1168,2016-03-14 00:00:00,2016-03-14,1^ALEX,99.0,03-14,2016,3,Alexandra Bridge
1169,2016-03-15 00:00:00,2016-03-15,1^ALEX,193.0,03-15,2016,3,Alexandra Bridge
1170,2016-03-16 00:00:00,2016-03-16,1^ALEX,296.0,03-16,2016,3,Alexandra Bridge
1171,2016-03-17 00:00:00,2016-03-17,1^ALEX,363.0,03-17,2016,3,Alexandra Bridge
1172,2016-03-18 00:00:00,2016-03-18,1^ALEX,337.0,03-18,2016,3,Alexandra Bridge
1173,2016-03-19 00:00:00,2016-03-19,1^ALEX,166.0,03-19,2016,3,Alexandra Bridge
1174,2016-03-20 00:00:00,2016-03-20,1^ALEX,174.0,03-20,2016,3,Alexandra Bridge
1175,2016-03-21 00:00:00,2016-03-21,1^ALEX,405.0,03-21,2016,3,Alexandra Bridge
1176,2016-03-22 00:00:00,2016-03-22,1^ALEX,387.0,03-22,2016,3,Alexandra Bridge
1177,2016-03-23 00:00:00,2016-03-23,1^ALEX,375.0,03-23,2016,3,Alexandra Bridge
1178,2016-03-24 00:00:00,2016-03-24,1^ALEX,139.0,03-24,2016,3,Alexandra Bridge
1179,2016-03-25 00:00:00,2016-03-25,1^ALEX,47.0,03-25,2016,3,Alexandra Bridge
1180,2016-03-26 00:00:00,2016-03-26,1^ALEX,115.0,03-26,2016,3,Alexandra Bridge
1181,2016-03-27 00:00:00,2016-03-27,1^ALEX,323.0,03-27,2016,3,Alexandra Bridge
1182,2016-03-28 00:00:00,2016-03-28,1^ALEX,76.0,03-28,2016,3,Alexandra Bridge
1183,2016-03-29 00:00:00,2016-03-29,1^ALEX,472.0,03-29,2016,3,Alexandra Bridge
1184,2016-03-30 00:00:00,2016-03-30,1^ALEX,630.0,03-30,2016,3,Alexandra Bridge
1185,2016-03-31 00:00:00,2016-03-31,1^ALEX,252.0,03-31,2016,3,Alexandra Bridge
1186,01/04/2016,2016-04-01,1^ALEX,625.0,04-01,2016,4,Alexandra Bridge
1187,02/04/2016,2016-04-02,1^ALEX,245.0,04-02,2016,4,Alexandra Bridge
1188,03/04/2016,2016-04-03,1^ALEX,149.0,04-03,2016,4,Alexandra Bridge
1189,04/04/2016,2016-04-04,1^ALEX,500.0,04-04,2016,4,Alexandra Bridge
1190,05/04/2016,2016-04-05,1^ALEX,575.0,04-05,2016,4,Alexandra Bridge
1191,06/04/2016,2016-04-06,1^ALEX,316.0,04-06,2016,4,Alexandra Bridge
1192,07/04/2016,2016-04-07,1^ALEX,159.0,04-07,2016,4,Alexandra Bridge
1193,08/04/2016,2016-04-08,1^ALEX,285.0,04-08,2016,4,Alexandra Bridge
1194,09/04/2016,2016-04-09,1^ALEX,174.0,04-09,2016,4,Alexandra Bridge
1195,10/04/2016,2016-04-10,1^ALEX,234.0,04-10,2016,4,Alexandra Bridge
1196,11/04/2016,2016-04-11,1^ALEX,192.0,04-11,2016,4,Alexandra Bridge
1197,12/04/2016,2016-04-12,1^ALEX,617.0,04-12,2016,4,Alexandra Bridge
1198,13/04/2016,2016-04-13,1^ALEX,759.0,04-13,2016,4,Alexandra Bridge
1199,14/04/2016,2016-04-14,1^ALEX,985.0,04-14,2016,4,Alexandra Bridge
1200,15/04/2016,2016-04-15,1^ALEX,1101.0,04-15,2016,4,Alexandra Bridge
1201,16/04/2016,2016-04-16,1^ALEX,1031.0,04-16,2016,4,Alexandra Bridge
1202,17/04/2016,2016-04-17,1^ALEX,1583.0,04-17,2016,4,Alexandra Bridge
1203,18/04/2016,2016-04-18,1^ALEX,1028.0,04-18,2016,4,Alexandra Bridge
1204,19/04/2016,2016-04-19,1^ALEX,1435.0,04-19,2016,4,Alexandra Bridge
1205,20/04/2016,2016-04-20,1^ALEX,1502.0,04-20,2016,4,Alexandra Bridge
1206,21/04/2016,2016-04-21,1^ALEX,1599.0,04-21,2016,4,Alexandra Bridge
1207,22/04/2016,2016-04-22,1^ALEX,636.0,04-22,2016,4,Alexandra Bridge
1208,23/04/2016,2016-04-23,1^ALEX,693.0,04-23,2016,4,Alexandra Bridge
1209,24/04/2016,2016-04-24,1^ALEX,825.0,04-24,2016,4,Alexandra Bridge
1210,25/04/2016,2016-04-25,1^ALEX,1121.0,04-25,2016,4,Alexandra Bridge
1211,26/04/2016,2016-04-26,1^ALEX,1100.0,04-26,2016,4,Alexandra Bridge
1212,27/04/2016,2016-04-27,1^ALEX,1213.0,04-27,2016,4,Alexandra Bridge
1213,28/04/2016,2016-04-28,1^ALEX,1244.0,04-28,2016,4,Alexandra Bridge
1214,29/04/2016,2016-04-29,1^ALEX,1400.0,04-29,2016,4,Alexandra Bridge
1215,30/04/2016,2016-04-30,1^ALEX,1386.0,04-30,2016,4,Alexandra Bridge
1216,01/05/2016,2016-05-01,1^ALEX,274.0,05-01,2016,5,Alexandra Bridge
1217,02/05/2016,2016-05-02,1^ALEX,1140.0,05-02,2016,5,Alexandra Bridge
1218,03/05/2016,2016-05-03,1^ALEX,1881.0,05-03,2016,5,Alexandra Bridge
1219,04/05/2016,2016-05-04,1^ALEX,1673.0,05-04,2016,5,Alexandra Bridge
1220,05/05/2016,2016-05-05,1^ALEX,2067.0,05-05,2016,5,Alexandra Bridge
1221,06/05/2016,2016-05-06,1^ALEX,2117.0,05-06,2016,5,Alexandra Bridge
1222,07/05/2016,2016-05-07,1^ALEX,1504.0,05-07,2016,5,Alexandra Bridge
1223,08/05/2016,2016-05-08,1^ALEX,444.0,05-08,2016,5,Alexandra Bridge
1224,09/05/2016,2016-05-09,1^ALEX,1450.0,05-09,2016,5,Alexandra Bridge
1225,10/05/2016,2016-05-10,1^ALEX,2085.0,05-10,2016,5,Alexandra Bridge
1226,11/05/2016,2016-05-11,1^ALEX,2564.0,05-11,2016,5,Alexandra Bridge
1227,12/05/2016,2016-05-12,1^ALEX,2587.0,05-12,2016,5,Alexandra Bridge
1228,13/05/2016,2016-05-13,1^ALEX,1163.0,05-13,2016,5,Alexandra Bridge
1229,14/05/2016,2016-05-14,1^ALEX,787.0,05-14,2016,5,Alexandra Bridge
1230,15/05/2016,2016-05-15,1^ALEX,448.0,05-15,2016,5,Alexandra Bridge
1231,16/05/2016,2016-05-16,1^ALEX,1366.0,05-16,2016,5,Alexandra Bridge
1232,17/05/2016,2016-05-17,1^ALEX,1832.0,05-17,2016,5,Alexandra Bridge
1233,18/05/2016,2016-05-18,1^ALEX,2178.0,05-18,2016,5,Alexandra Bridge
1234,19/05/2016,2016-05-19,1^ALEX,2392.0,05-19,2016,5,Alexandra Bridge
1235,20/05/2016,2016-05-20,1^ALEX,2612.0,05-20,2016,5,Alexandra Bridge
1236,21/05/2016,2016-05-21,1^ALEX,2095.0,05-21,2016,5,Alexandra Bridge
1237,22/05/2016,2016-05-22,1^ALEX,2655.0,05-22,2016,5,Alexandra Bridge
1238,23/05/2016,2016-05-23,1^ALEX,2466.0,05-23,2016,5,Alexandra Bridge
1239,24/05/2016,2016-05-24,1^ALEX,2538.0,05-24,2016,5,Alexandra Bridge
1240,25/05/2016,2016-05-25,1^ALEX,2435.0,05-25,2016,5,Alexandra Bridge
1241,26/05/2016,2016-05-26,1^ALEX,2657.0,05-26,2016,5,Alexandra Bridge
1242,27/05/2016,2016-05-27,1^ALEX,2277.0,05-27,2016,5,Alexandra Bridge
1243,28/05/2016,2016-05-28,1^ALEX,1793.0,05-28,2016,5,Alexandra Bridge
1244,29/05/2016,2016-05-29,1^ALEX,1780.0,05-29,2016,5,Alexandra Bridge
1245,30/05/2016,2016-05-30,1^ALEX,2518.0,05-30,2016,5,Alexandra Bridge
1246,31/05/2016,2016-05-31,1^ALEX,2602.0,05-31,2016,5,Alexandra Bridge
1247,01/06/2016,2016-06-01,1^ALEX,2678.0,06-01,2016,6,Alexandra Bridge
1248,02/06/2016,2016-06-02,1^ALEX,1387.0,06-02,2016,6,Alexandra Bridge
1249,03/06/2016,2016-06-03,1^ALEX,2642.0,06-03,2016,6,Alexandra Bridge
1250,04/06/2016,2016-06-04,1^ALEX,1988.0,06-04,2016,6,Alexandra Bridge
1251,05/06/2016,2016-06-05,1^ALEX,257.0,06-05,2016,6,Alexandra Bridge
1252,06/06/2016,2016-06-06,1^ALEX,2035.0,06-06,2016,6,Alexandra Bridge
1253,07/06/2016,2016-06-07,1^ALEX,2396.0,06-07,2016,6,Alexandra Bridge
1254,08/06/2016,2016-06-08,1^ALEX,2124.0,06-08,2016,6,Alexandra Bridge
1255,09/06/2016,2016-06-09,1^ALEX,2110.0,06-09,2016,6,Alexandra Bridge
1256,10/06/2016,2016-06-10,1^ALEX,2235.0,06-10,2016,6,Alexandra Bridge
1257,11/06/2016,2016-06-11,1^ALEX,443.0,06-11,2016,6,Alexandra Bridge
1258,12/06/2016,2016-06-12,1^ALEX,504.0,06-12,2016,6,Alexandra Bridge
1259,13/06/2016,2016-06-13,1^ALEX,2003.0,06-13,2016,6,Alexandra Bridge
1260,14/06/2016,2016-06-14,1^ALEX,2573.0,06-14,2016,6,Alexandra Bridge
1261,15/06/2016,2016-06-15,1^ALEX,2929.0,06-15,2016,6,Alexandra Bridge
1262,16/06/2016,2016-06-16,1^ALEX,2874.0,06-16,2016,6,Alexandra Bridge
1263,17/06/2016,2016-06-17,1^ALEX,2556.0,06-17,2016,6,Alexandra Bridge
1264,18/06/2016,2016-06-18,1^ALEX,1601.0,06-18,2016,6,Alexandra Bridge
1265,19/06/2016,2016-06-19,1^ALEX,1529.0,06-19,2016,6,Alexandra Bridge
1266,20/06/2016,2016-06-20,1^ALEX,2146.0,06-20,2016,6,Alexandra Bridge
1267,21/06/2016,2016-06-21,1^ALEX,2354.0,06-21,2016,6,Alexandra Bridge
1268,22/06/2016,2016-06-22,1^ALEX,2553.0,06-22,2016,6,Alexandra Bridge
1269,23/06/2016,2016-06-23,1^ALEX,2529.0,06-23,2016,6,Alexandra Bridge
1270,24/06/2016,2016-06-24,1^ALEX,1976.0,06-24,2016,6,Alexandra Bridge
1271,25/06/2016,2016-06-25,1^ALEX,1550.0,06-25,2016,6,Alexandra Bridge
1272,26/06/2016,2016-06-26,1^ALEX,1612.0,06-26,2016,6,Alexandra Bridge
1273,27/06/2016,2016-06-27,1^ALEX,1575.0,06-27,2016,6,Alexandra Bridge
1274,28/06/2016,2016-06-28,1^ALEX,2297.0,06-28,2016,6,Alexandra Bridge
1275,29/06/2016,2016-06-29,1^ALEX,791.0,06-29,2016,6,Alexandra Bridge
1276,30/06/2016,2016-06-30,1^ALEX,2488.0,06-30,2016,6,Alexandra Bridge
1277,01/07/2016,2016-07-01,1^ALEX,533.0,07-01,2016,7,Alexandra Bridge
1278,02/07/2016,2016-07-02,1^ALEX,1292.0,07-02,2016,7,Alexandra Bridge
1279,03/07/2016,2016-07-03,1^ALEX,2221.0,07-03,2016,7,Alexandra Bridge
1280,04/07/2016,2016-07-04,1^ALEX,2499.0,07-04,2016,7,Alexandra Bridge
1281,05/07/2016,2016-07-05,1^ALEX,2719.0,07-05,2016,7,Alexandra Bridge
1282,06/07/2016,2016-07-06,1^ALEX,2419.0,07-06,2016,7,Alexandra Bridge
1283,07/07/2016,2016-07-07,1^ALEX,2020.0,07-07,2016,7,Alexandra Bridge
1284,08/07/2016,2016-07-08,1^ALEX,1833.0,07-08,2016,7,Alexandra Bridge
1285,09/07/2016,2016-07-09,1^ALEX,221.0,07-09,2016,7,Alexandra Bridge
1286,10/07/2016,2016-07-10,1^ALEX,998.0,07-10,2016,7,Alexandra Bridge
1287,11/07/2016,2016-07-11,1^ALEX,2649.0,07-11,2016,7,Alexandra Bridge
1288,12/07/2016,2016-07-12,1^ALEX,2748.0,07-12,2016,7,Alexandra Bridge
1289,13/07/2016,2016-07-13,1^ALEX,2153.0,07-13,2016,7,Alexandra Bridge
1290,14/07/2016,2016-07-14,1^ALEX,1665.0,07-14,2016,7,Alexandra Bridge
1291,15/07/2016,2016-07-15,1^ALEX,1745.0,07-15,2016,7,Alexandra Bridge
1292,16/07/2016,2016-07-16,1^ALEX,1536.0,07-16,2016,7,Alexandra Bridge
1293,17/07/2016,2016-07-17,1^ALEX,2036.0,07-17,2016,7,Alexandra Bridge
